"Image","Name","Rate Star","Sold","Selling Price","Original Price","Available Product","Description"
"https://down-vn.img.susercontent.com/file/vn-11134207-7r98o-lmetjjsetyov67@resize_w900_nl.webp","combo 10 đôi tất cổ cao thấp nam nữ vớ cao cổ phong cách thể thao hàn quốc hàng dệt kim cao cấp","4.8","32,5k","₫30.000 - ₫75.000","₫30.000 - ₫130.000","31995","GIỚI THIỆU SẢN PHẨM :Vớ tất cao cổ nam nữ phong cách thể thao hàn quốc hàng dệt kim cao cấp giá rẻTất hay còn được gọi là vớ chân, bít tất là phụ kiện thời trang có mặt trong tủ đồ của mọi người tiêu dùng.Tất chân thường được sử dụng với mục đích giữ ấm bàn chân, bảo vệ sức khỏe hoặc đơn giản là thấm hút mồ hôi trong quá trình bạn đi giày.THÔNG TIN SẢN PHẨM : Vớ tất cao cổ nam nữ phong cách thể thao hàn quốc hàng dệt kim cao cấp giá rẻChất liệu: Tất vớ được làm từ 100% cotton giúp khử mùi kháng khuẩn rất tốtChất liệu vải mềm, nhẹ, co giãn 4 chiều, thấm hút mồ hơi cực tốtMàu sắc : Nhiều màuKích thước : phù hợp mọi size chânƯU ĐIỂM CỦA SẢN PHẨM : Vớ tất cao cổ nam nữ phong cách thể thao hàn quốc hàng dệt kim cao cấp giá rẻTất vớ mỏng thoáng, phần chun mảnh không gây hằn, đau khi sử dụngChất liệu 100% cotton giúp khử mùi kháng khuẩn rất tốtThiết kế tinh tế cực kỳ đáng yêu, trẻ trung, năng động và đặc biệt rất thời trangChất liệu vải mềm, nhẹ, co giãn 4 chiều, thấm hút mồ hơi cực tốtHƯỚNG DẪN PHỐI ĐỒ VỚI : Vớ tất cao cổ nam nữ phong cách thể thao hàn quốc hàng dệt kim cao cấp giá rẻCách 1:Bạn có thể mix vớ trắng + giày trắng kèm áo sơ mi trắng và quần short, túi tote trắngCách 2:Giày xanh + Vớ trắng + short bò trắng + sơ mi mỏng hồngRất nhiều cách mix đồ khác nhau với vớ cho các bạn nữ thỏa sức sáng tạoHƯỚNG DẪN GIẶT VÀ BẢO QUẢN :Vớ tất cao cổ nam nữ phong cách thể thao hàn quốc hàng dệt kim cao cấp giá rẻPhân loại Tất Vớ chân trước khi giặtLộn trái Tất Vớ chân trước khi giặtGiặt sạch Tất Vớ của bạn sau mỗi ngày sử dụngShop cam kết :- Nếu quý khách không hài lòng với bất kì lí do gì. Shop sẽ hoàn tiền hoặc gửi lại sản mới thay thế cho quý khách-Hình ảnh sản phẩm giống 100% ( có thể lệch 1-2% do ánh sáng )- Sản phẩm được kiểm tra kĩ càng, nghiêm ngặt trước khi giao hàng.- Sản phẩm luôn có sẵn trong kho hàng.- Giao hàng ngay khi nhận được đơn hàng.#tatcocao #cotrung  #colung #tatcocaonu #thethao #vococaonu #tron #vococao #vintage #tatcocaonuhanquoc #cothap #cotton #longcuu #cogian #hoatiet #chonghoichan #ulzzang #giare #xinh #tatnike"
"https://down-vn.img.susercontent.com/file/vn-11134207-7r98o-llyofq51ayn33f@resize_w900_nl.webp","Tất Vớ Nike Trắng Đen Thể Thao Cổ Ngắn Cổ Trung Cổ Cao Nam Nữ Vải Dệt Kim","4.8","707k","₫6.100 - ₫8.800","₫14.000","59800580","Tất Vớ Nike Trắng Đen Thể Thao Cổ Ngắn Cổ Trung Cổ Cao Nam Nữ Thời Trang UnisexShop Mới Có Voucher Trong Shop nha mn❣️ Tất Vớ Nike vải Dệt Kim Nên Anh Chị cứ yên tâm về chất lượng luôn nha⚠️ ĐƠN TỪ 50K HỖ TRỢ FREE SHIP⚠️ CAM KẾT CHẤT LƯỢNG SẢN PHẨM ĐÚNG NHƯ MÔ TẢ⚠️ ĐỔI TRẢ MIỄN PHÍ NẾU DO LỖI CỦA SHOP❣️VD:+CỰC KỲ PHÙ HỢP MỚI NHỮNG ANH ĐI CHƠI THỂ THAO CHẠY BỘ NHA.+CÒN CHỊ EM THÌ MÌNH LẤY SIZE NGẮN HOĂC TRUNG ĐỂ PHỐI ĐỒ THÌ CHUẨN PHONG CÁCH THỂ THAO LUÔN NHA.🏆Hàng Đẹp Chất Lượng Cao nên mọi người yên tâm nha->Tất Vớ Dệt Kim  Chất liệu  Cotton, dày dặn, mềm, không dão, không xù lông, đi lên cực chất->Đặc biệt thông thoáng, không bí, không tạo mùi hôi, đá rất êm chân.Anh em CHƠI THỂ THAO VÀ ĐI SNEAKER cực kỳ yêu thích.🏆Hiện Tại Shop Có 2 màu: Trắng Đen nha📌Hãy mua và trải nghiệm dịch vụ của chúng tôi với chế độ chăm sóc khách hàng và chế độ hậu mãi cực kì tốt ạ.Liên tục đưa ra các chương trình KM cho khách hàng có thể trải nghiệm dịch vụ với giá thành rẻ nhất.📌Shop luôn onile 24/24, Cửa hàng chính thức:#tatvo4am #Tatvo #tat #Vo #vodep #vothoitrang #tatnu #tatnam #tatnamnu #tatdep #vodep #vothethao #tatthethao #tatnike #nike #thethao #vothethao #vonike #nikechinhhang #vonikechinhhang #tatnikechinhhang"
"https://down-vn.img.susercontent.com/file/vn-11110105-7r98o-lqus1t5msbhf13@resize_w164_nl.webp","Thắt lưng nam da cao cấp, dây lưng nam mặt khóa tự động sang trọng, nịt da màu đen TLĐ01","4.7","54,9k","₫0","₫10.000","225705","Thắt lưng nam da cao cấp, dây lưng nam mặt khóa tự động sang trọng, nịt da màu đen TLĐ01Dây Lưng Nam Khóa gạt tự động tiện lợi dễ dàng sử dụng*  MỤC ĐÍCH SỬ DỤNG- Thắt lưng nam có thể đeo đi chơi, dạo phố, dự tiệc đều tạo một phong cách đầy cá tính sang trọng.- Có thể dùng Thắt lưng nam làm món quà tặng anh, em, bạn bè đồng nghiệp trong các dịp sự kiện, sinh nhật đều rất đẹp và ý nghĩa.Tinh xảo và sắc nét được tạo khối và mạ đẹp mắt tạo nên nét sang trọng và đẳng cấp cho món phụ kiện luôn dễ dàng hấp dẫn các quý ông và là điểm sáng tinh tế cho mọi trang phục.CHI TIẾT SẢN PHẨM : Thắt lưng nam, Thắt lưng da, Dây nịt nam, Dây lưng nam- Thắt lưng da mềm, chất liệu da cao cấp.- Dây lưng nam thiết may giấu viền kiểu dáng thời trang lịch lãm.- Kích thước thắt lưng da nam: 3,5x120cmBông Store CAM KẾT:1)	Cam kết chất lượng và sản phẩm dây thắt lưng giống với hình ảnh.2)	Thắt lưng da được shop tuyển chọn kỹ càng trước khi giao đến tay khách.3)	Hoàn tiền nếu sản phẩm dây nịt nam không giống với mô tả.4)	Trả hàng hoàn tiền trong 15 ngày nếu dây nịt nam có lỗi sai sót từ phía ShopNếu khách nhận hàng ko ưng, khách cứ inbox shop nhé,  shop cam kết sẽ nhận lại hàng và hoàn tiền cho khách ạ !#daythatlung #daynitnam  #dâylưngnam #daylungnam  #thắtlưngnam, #thatlungnam #thắt_lưng_nam #that_lung_nam  #thắtlưng_nam #that_lung_nam #dây_nịt_nam #day_nit_nam #dây_nịt_nam #dâynịt_nam #daynit_nam #thatlung_nam #thắtlưngnam #thăt_lưng_nam"
"https://down-vn.img.susercontent.com/file/vn-11110105-7r98o-lrsmoyhulllvdf@resize_w164_nl.webp","Thắt Lưng Nam Khóa Tự Động Cao Cấp Mặt Xoay Chính Hãng , Dây Nịt Nam Phong Cách Hàn Quốc","4.6","19,9k","₫0","₫10.000","2767980","Thắt lưng mặt xoay nam thắt lưng nam cao cấp thời trang dây nịt da khóa tự động X003Shop luôn cập nhật những mẫu mã thắt lưng nam mặt xoay mới nhất, hot nhất thị trường, khách hàng hãy ấn theo dõi shop để xem đc các sản phẩm dây lưng nam cao cấp mới nhất nhé.MÔ TẢ SẢN PHẨM- Thắt lưng da nam mềm, chất liệu da pu cao cấp, thắt lưng mặt xoay nam có độ bền lâu dài- Thắt lưng lưng nam mặt xoay thiết mới kiểu dáng thời trang lịch lãm- Thắt lưng mặt xoay nam được làm bằng chất liệu hợp kim chống xước, chống gỉ- Kích thước thắt lưng da nam: 3,5x125cm- Thắt lưng mặt xoay nam dễ dàng kết hợp cùng trang phục- Cam kết tất cả ảnh sản phẩm Thắt lưng mặt xoay nam do shop tự chụp, sản phẩm 100% giống hình- Thắt lưng nam không chỉ là một vật dụng thiết yếu mà còn  giúp phái mạnh khẳng định đẳng cấp và sành điệu của mình.- Khi sử dụng xong, bạn nên tháo dây thắt lưng nam khóa tự động ra khỏi quần, luôn treo dây lưng da nam theo chiều thẳng đứng, không gập uốn, không cuộn tròn dây lưng nam cất trong hộp kín- Khi không dùng đến, hãy bỏ giấy báo và hạt hút ẩm vào hộp giấy đựng dây lưng nam, đặt hộp nơi thoáng mát, khô ráo- Thường xuyên thoa chất bảo quản chuyên dụng cho đồ da để giữ độ ẩm cũng như độ bóng mịn của bề mặt dây thắt lưng da- Nên để sản phẩm ở nơi khô thoáng, tránh ẩm thấp sẽ làm bề mặt da bị dễ bị mùi hôi, nhanh chóng mục nát- Nguyên tắc bắt buộc phải để dây lưng da nam tránh ánh sáng mặt trời- Đối với chiếc dây lưng da nam dùng lâu ngày thường bị bạc màu và khô cứng, bạn có thể sử dụng sữa tươi, khoai tây, dầu thông,…để làm mới bề mặt dây thắt lưng nam- Shop có các loại mặt thắt lưng nam giống trong ảnh sản phẩm, quý khách có thể xem thêm các mẫu thắt lưng nam trong shop. Nếu khách muốn chọn chính xác mặt thắt lưng nam thì có thể ib cho shop.Mọi thắc mắc khách hàng hãy innox trực tiếp để bên mình hỗ trợ ạ ♥️#thatlungnam #daythatlungnam #thatlungda #thatlungmatxoay #daylung #daylungnam #thatlungmatxoaynam #daylungda #thatlung #thatlungnamdaxoay #daynit #daynitnam #daynitgiare #daythatlung #daylungnamdaxoay #thatlungthoitrang #thatlunggiare #daynitnamdaxoay"
"https://down-vn.img.susercontent.com/file/vn-11110105-6khwh-m4c2kpgxn37rf2_cover@resize_w164_nl.webp","Thắt lưng nam ⚡️ Giảm Giá Cực Sốc ⚡️ cao cấp, dây nịt nam khóa tự động sang trọng phong cách","4.6","15,5k","₫0","₫10.000","43522","- Thắt lưng nam có thể đeo đi chơi, dạo phố, dự tiệc đều tạo một phong cách đầy cá tính sang trọng.- Có thể dùng Thắt lưng nam làm món quà tặng anh, em, bạn bè đồng nghiệp trong các dịp sự kiện, sinh nhật đều rất đẹp và ý nghĩa.Tinh xảo và sắc nét được tạo khối  đẹp mắt tạo nên nét sang trọng và đẳng cấp cho món phụ kiện luôn dễ dàng hấp dẫn các quý ông và là điểm sáng tinh tế cho mọi trang phục.CHI TIẾT SẢN PHẨM : Thắt lưng nam, Thắt lưng da, Dây nịt nam, Dây lưng nam- Thắt lưng da mềm, chất liệu da cao cấp.- Dây lưng nam da nguyên miếng kiểu dáng thời trang lịch lãm.- Kích thước thắt lưng da nam: 3 x 120cmHƯỚNG DẪN SỬ DỤNG- Dây lưng dài hơn vòng bụng, bạn tháo dây lưng chỗ đầu khóa -> ướm với bụng -> cắt bớt dây sao cho vừa bụng -> lắp lại là được.KICHAELS CAM KẾT:1)	Cam kết chất lượng và sản phẩm dây thắt lưng giống với hình ảnh.2)	Thắt lưng da được shop tuyển chọn kỹ càng trước khi giao đến tay khách.3)	Trả hàng hoàn tiền trong 15 ngày nếu dây nịt nam có lỗi từ nhà sản xuất#thatlungnam #daynichnam #thatlung #daythatlung #nitnam #daylung #daynitnam #daythatlungnam #daynich #nichnam #thatlungnamdabo #nit #daylungnam #thatlungda #daylungdabothat #daynit #daynitnam #thatlungnamhanghieu"
"https://down-vn.img.susercontent.com/file/vn-11110105-6khw2-m93u2wyrdp4e47_cover@resize_w164_nl.webp","Thắt lưng nam chữ kẻ caro, dây lưng nam Caro đủ màu, đầu khóa cài chữ nhỏ A1C1V","4.7","82,7k","₫10.000 - ₫36.000","₫10.000 - ₫50.000","28889","XƯỞNG DÂY LƯNG HÀ NỘIChuyên sản xuất, kinh doanh dây lưng, ví da, các phụ kiện đi kèm khácThắt lưng nam chữ kẻ caro, dây lưng nam caro đủ màu đầu khóa chữ nhỏ A1C1V⁕Thông số dây lưng nam:✓ Kích thước thắt lưng : dài 110 cm, rộng 3,6cm, dày 4mm.✓ Chất liệu : Da Pu✓ Màu sắc dây lưng caro: Nâu hoa , Kẻ trắng, Đen truyền thống, Kẻ Xanh, Kẻ Nâu hoa, Đen hoa vàng, nâu trơn✓ Mặt khóa: Khóa cài 4cm. Mặt khóa được được mạ vàng✓ Dây nịt nam đã được đục sẵn 5 lỗ, nên rất mong quý khách hàng lưu ý.✓ Hộp dây lưng các bạn mùa kèm để làm quà tặng cho anh,bố,...----------------------------------------------------------------------------✓Chú ý: Quý khách muốn được tư vấn thêm về sản phẩm hãy liên hệ qua phần Chat cho shop để được phản hồi nhanh nhất.▣ XƯỞNG CAM KẾT✓ Ảnh chụp sản phẩm thực tế.✓ Sản phẩm 100% giống mô tả. Kiểu dáng hoàn toàn giống ảnh mẫu✓Thắt lưng được kiểm tra kĩ càng, cẩn thận, tư vấn nhiệt tình trước khi gói hàng giao cho Quý Khách✓ Hàng có sẵn, giao hàng ngay khi nhận được đơn✓ Miễn phí đổi trả trong vòng 7 ngày nếu do lỗi nhà sản xuất, hoàn tiền nếu sản phẩm không giống với mô tả.✓Giao hàng nhanh toàn quốc#thatlung #daylung#daylungcaro #daylungnamcaro #daylungnam#thatlungda  #thatlung  #nitnam #thatlungnam#thatlungnam  #daynitnam  #daylungnam"
"https://down-vn.img.susercontent.com/file/vn-11110107-6khw1-m4q8u5reqv9rdd_cover@resize_w164_nl.webp","Tất cổ ngắn nam nữ 🔥 Giá Sốc 🔥 vải cotton mềm mại co giãn 4 chiều, tất vớ thấp chống hôi chân","4.8","8,9k","₫0","₫6.999","39555","LƯU Ý: Trước khi đặt sản phẩm quý khách chú ý kiểm tra PHÍ VẬN CHUYỂNTất cổ ngắn nam nữ🔥Giá Sốc🔥vải cotton mềmmại co giãn 4 chiều, Vớ thấp màu trơn chống hôi chânThông tin sản phẩm tất ngắn nam:- Được thiết kế theo đúng form chuẩn của nam giới Việt Nam- Sản phẩm chính là mẫu thiết kế mới nhất- Chất liệu co giãn, cực mềm mịn, thoáng mát mồ hôi, chống hôi chân- Đem lại sự thoải mái tiện lợi nhất cho người sử dụngChế độ bảo hành :- Tất cả các sản phẩm đều được shop bảo hành đổi trả theo quy định của Shopee- Đối với sản phẩm lỗi/đơn hàng thiếu sản phẩm, quý khách vui lòng nhắn tin ngay cho shop#do #nam #bong #da #bongda #re #giare #thoitrangnam #dui #bodui #vaidui #tat #vo #tatnam #vonam #bittat"
"https://down-vn.img.susercontent.com/file/81b479979d18e296f7d4454730b9c140@resize_w900_nl.webp","Tất nam nữ cổ cao cổ trung cổ thấp thể thao thời trang cao cấp màu trắng, màu đen TAT23","4.8","272,8k","₫6.900 - ₫7.900","₫11.800 - ₫13.800","334138","Tất nam nữ cổ cao cổ trung cổ thấp thể thao thời trang cao cấp màu trắng, màu đen TAT23🏆Em lại nhập về thêm vài trăm đôi nữa phục vụ các anh đây, a nào đã sử dụng rồi thì biết độ ngon của tất dệt kim ntn rồi đó 😜😜🏆Cam kết không bung chỉ, xù lông, nhão...🏆 Lưu ý: Giặt máy sẽ không được sạch mà còn gây ra xù lông, giảm tuổi thọ của tất nên các anh em hãy bỏ vào thau và vò bằng tay nhé ❤️❤️❤️Tất Vớ Dệt Kim  Chất liệu Cotton, dày dặn, mềm, không dão, không xù lông, đi lên cực chấtĐặc biệt thông thoáng, không bí, không tạo mùi hôi, đá rất êm chân.Anh em CHƠI THỂ THAO VÀ ĐI SNEAKER cực kỳ yêu thích.-Thiết kế tất tinh tế cực kỳ đáng yêu, trẻ trung, năng động và đặc biệt rất thời trang-Chun tất với công nghệ dệt kim tự động đảm bảo không bị nhão sau một thời gian sử dụng-Chất liệu vải mềm, tất mỏng nhẹ thoáng, co giãn 4 chiều-Đặc biệt sản phẩm tất rất dề phối đồ cho các bạn nữ-Tất 4 mùa đều đi được mang lại cảm giác thoải mái- Phù hợp cho các bạn chân đi giày size từ 35-44- Số lượng tính: 1 đôi gồm 2 chiếc.🍀🍀🍀 Hướng dẫn giặt và bảo quản:Giặt tay nhẹ nhàngPhơi ngang trên móc, tránh ánh nắng trực tiếp.Xếp vớ gọn gàng để không bị nhăn.Tránh những vật dụng sắc nhọn làm xước tất - vớ📌Hãy mua và trải nghiệm dịch vụ của chúng tôi với chế độ chăm sóc khách hàng và chế độ hậu mãi cực kì tốt ạ.Liên tục đưa ra các chương trình KM cho khách hàng có thể trải nghiệm dịch vụ với giá thành rẻ nhất.📌Shop luôn onile 24/24, Cửa hàng chính thức:#tatdetkim #tatthethao #tấtnam #vớnam #tấtnữ #vớnữ #tấtcaocổnữ #vớcổcao #tấtnamcổngắn #tấtcổcao #tatnam #vonam #tatnu #vonu #tatcaoconu #tatnucongan #vococao"
"https://down-vn.img.susercontent.com/file/vn-11110105-6khwc-m6c32sqnc4s699_cover@resize_w164_nl.webp","Áo Phông Cho Nam Nữ Dsquared2 Họa Tiết in hình cây dừa Cực Sắc Nét Đẹp 2 Màu Trắng Đen hot 2025 [M02]","4.4","6,3k","₫1.500","₫15.000","443067","Tất cả Hình Ảnh, Video đều được shop tự quay, chụp. Hình ảnh sao nhận hàng vậy.🖋Bảo hàng đổi trà hoàn tiền theo chính sách của shopee trong các trường hợp: lỗi do nhà sản xuất, shop gửi nhầm mẫu, hư hỏng do vận chuyển...🖋Hỗ trợ đổi size cho khách hàng khi áo còn nguyên vẹn.✈ Ship cod toàn quốc🖋Nhận hàng hàng TRƯỚC - Thu tiền SAU2️⃣𝐇𝐮̛𝐨̛́𝐧𝐠 𝐃𝐚̂̃𝐧 𝐒𝐮̛̉ 𝐃𝐮̣𝐧𝐠 : -⛔ Không dùng hóa chất hay bột giặt có hoạt tính tẩy rửa mạnh⛔ Không dùng bàn chải cứng để vệ sinh giày sẽ làm hư⛔ Không đi mưa ngâm nước lâu, không phơi áo trực tiếp dưới ngoài trời nắng gắt⛔Với các sàn phẩm sáng màu, nên vệ sinh thường xuyên⛔ Tránh cất giữ giày khi còn ướt, ẩm..3️⃣ Mô tả chi tiết:✔️Đủ size Nam nữ : S - XXL✔️Hàng chất lượng✔️Giá rẻ✔️Quý khách cứ yên tâm , chúng tôi luôn đem đến cho quý khách những sản phẩm chất lượng nhất với giá thành hợp lý nhất .✔️Bảo hành do lỗi sản xuất : 01 Tháng✔️ Kiểu dáng hot trend của năm nay và còn kéo dài trong những năm tiếp theo.✔️Áo đẹp, thấm hút mồ hôi tốt, bền. Giá phải chăng phù hợp với các bạn học sinh, sinh viên. Có thể làm áo đôi, áo nhóm. Thích hợp đi chơi, du lịch, chạy bộ, gym, đi học, đi làm...✔️ Dễ phối đồ, có thể kết hợp với váy, jeans, sooc…. Phù hợp với mọi thời tiết từ đông sang hè.4️⃣ Lời muốn nóiCảm ơn các bạn đã tin tưởng ủng hộ, chúc các bạn mang lên chân những đôi giày đẹp nhất và ưng ý nhấtHãy để lại đánh giá của mình về chất lượng sản phẩm để shop và mọi có thể nhìn nhận khách quan nhất.Đừng quên theo dõi shop để cập nhập những mẫu hot hàng ngày."
"https://down-vn.img.susercontent.com/file/vn-11110105-7r98o-lpc1e9b7ghlub4@resize_w164_nl.webp","Thắt Lưng Nam 🎁 Giá Sốc 🎁 khóa tự động cao cấp, dây nịt nam mặt xoay 360 độ thể thao","4.5","11,9k","₫0","₫10.000","39665","Thắt lưng nam luôn là phụ kiện không thể thiếu cũng như không bao giờ lỗi mốt đối với các tín đồ thời trang, dù bạn theo đuổi phong cách nào đi chăng nữa. Thắt lưng  là một trong những phụ kiện mà các đấng mày râu muốn được sở hữu. Với xu hướng thời trang mới nhất hiện nay, thì mẫu dây thắt lưng làm bằng chất liệu cao cấp càng được ưa chuộng nhiều hơn.Để chọn được một chiếc dây nịt nam phù hợp- Độ dài: Chọn một chiếc dây nịch nam đúng size rất quan trọng vì đây chính là phụ kiện giúp quần áo vừa vặn với cơ thể hơn.- Kiểu dáng: nên chọn loại dây lưng nam có độ rộng từ 2,5 đến 3,8cm khi nó có thể kết hợp với mọi loại trang phục cũng như phù hợp với mọi hoàn cảnh.- Màu sắc: hãy chọn chiếc thắt lưng da có cùng màu với những đôi giày bạn hay mang.- Các bạn nam có thể phối dây lưng cùng quần jeans, quần tây hay quần short tùy ý thích.🔸 THÔNG TIN SẢN PHẨM THẮT LƯNG NAM MẶT TRÒN KHÓA XOAYa) Trọng lượng : 190 gramb) Thông số kỹ thuật;♥️ Dây lưng da PU : 2 màu Nâu / Đen- Dây da PU: dài 120 cm; rộng 3,3 cm; độ dày 0,3 cm. Dây lưng da Pu được sản xuất  quy mô công nghiệp dựa trên dây chuyền công nghệ máy móc hiện đại. Nên dây rất đẹp, mềm, dẻo dai, độ bền cao.♥️ Mặt khóa thắt lưng: 3 màu Vàng / Bạc / Đen  tròn xoay đính đá sang trọng-  Mặt khóa :  dài 8,5 cm ; rộng 4 cm ; độ dày 1,5 - 2 cm. Mặt khóa kim loại đúc không gỉ.♥️ Lẫy khóa nam châm kết hợp rãnh răng cưa trên dây da tạo nên bộ thắt lưng nam trượt tự động thông minh.c) Thông tin cảnh báo;- Không để thắt lưng trong môi trường ẩm thấp. Không để ngoài  trời nắngd) Hướng dẫn sử dụng, hướng dẫn bảo quản;🔸 HƯỚNG DẪN CHỌN MẪU- Bộ thắt lưng : Mặt khóa kim loại + dây da Pu- Mặt khóa lẻ- Dây da Pu lẻ- Dây da bò lẻ🔸 Bảo quản : Luôn treo dây lưng da theo chiều thẳng đứng , lau chùi dây lưng bằng vải mềm.🔸 SHOP CAM KẾT- Sản phẩm  giống mô tả. Kiểu dáng hoàn toàn giống video, ảnh mẫu shop tự chụp- Thắt lưng được kiểm tra kĩ càng, cẩn thận, tư vấn nhiệt tình trước khi gói hàng giao cho Quý Khách- Bảo hành 1 năm lỗi một đổi một, miễn phí đổi trả, hoàn tiền nếu không đúng cam kết#thatlungnam #daynichnam #thatlung #daythatlung #nitnam #daylung #daynitnam #daythatlungnam #daynich #nichnam #thatlungnamdabo #nit #daylungnam #thatlungda #daylungdabothat #daynit #daynitnam #thatlungnamhanghieu"
"https://down-vn.img.susercontent.com/file/vn-11110105-7r98o-m0c0q5eaiixc58@resize_w164_nl.webp","Áo Thun Tay Lỡ Nam Nữ Cotton Unisex , Áo Phông Cổ Tròn Form Rộng Basic Oversize HUNEE 2024 - Buoi Bồ Iu","4.7","3,3k","₫38.000","₫98.000","2140199","Áo Thun Tay Lỡ Nam Nữ Cotton Unisex , Áo Phông Cổ Tròn Form Rộng Basic Oversize HUNEE 2024 _ Buoi Bồ IuChất Liệu: Cotton Su  ( Phiên bản chất vải  thoáng mát, mềm mịn nhưng không bị nhăn hay xù )Kiểu Dáng: OVERSIZEMàu Sắc: Trắng _ ĐenLoại In: In Pet NhiệtXuất Xứ: Việt NamSize: M / L / XLForm áo được Fit size theo form và tiêu chuẩn tương đối của người Việt Nam, nếu bạn đang cân nhắc giữa hai size hãy nhắn tin cho Shop để được tư vấn size phù hợp nhất nhaa !!_  Size M: Dài 67Cm, Rộng 51Cm, Dài tay áo 25Cm (Dưới 1m6, 35kg_ 46Kg)_  Size L: Dài 70Cm, Rộng 53Cm, Dài tay áo 25Cm (1m6 _ 1m7, 46Kg _ 65Kg)_  Size XL: Dài 73Cm, Rộng 56Cm, Dài tay áo 25Cm (1m7 _ 1m75, 66Kg _ 75Kg)HƯỚNG DẪN ĐỔI TRẢ1. Điều kiện đổi hàng_ Đối với sản phẩm áo quần, thời gian đổi hàng trong vòng 7 ngày kể từ ngày khách hàng nhận bưu phẩm._ Áp dụng đổi hàng với tất cả các sản phẩm và sản phẩm được đổi phải còn nguyên nhãn mác, trong tình trạng chưa qua sử dụng.2. Cách thức quay video unbox:_ Clip rõ nét từ cảnh kiểm tra bề mặt gói hàng, lúc mở đến kiểm tra hàng._ Clip không cắt ghép, không chỉnh sửa._ Clip quay rõ thông tin trên bưu phẩm: Tên người nhận, mã đơn,*Lưu ý: Do màn hình và điều kiện ánh sáng khác nhau, màu sắc thực tế của sản phẩm có thể chênh lệch 3_5%.#aophong #aothun #aophongnu #aophongnam #aophonglocalbrand #aophongtrang #aophongcoco #aophong #aophongdoi #aophongrong #aothun #aothun #aothunnu #aothunnam #aothunlocalbrand #aothuntrang #aothuncoco #aothun #aothundoi #aothunrong #Local #brand #brand #local #aothungiare #aomuahe #cotton #aothunhaihuoc #custom #hunee"
