"Image","Name","Rate Star","Sold","Selling Price","Original Price","Available Product","Description"
"https://down-vn.img.susercontent.com/file/36ea90b0d1a27b9520363484c9cb5a41@resize_w164_nl.webp","Đế cao su bọc chân chống xe máy","4.9","68,7k","₫5.000 - ₫9.000","₫9.000 - ₫15.000","2792","Đế cao su bọc chân chống xe máyXe máy có lẽ là phương tiện giao thông phổ biến nhất tại Việt NamHiện nay trên thị trường có rất nhiều loại phụ kiện xe máy với nhiều công dụng khác nhau giúp việc sử dụng xe máy trở nên thuận tiện cũng như an toàn hơn như Đế cao su bọc chân chống xe máy. Bạt phủ xe máy. Ốc titan trang trí áo xẻ...Mô tả chi tiết sản phẩm Đế cao su bọc chân chống xe máy:- Tránh trầy xước nền nhà bằng gạch men hoặc các vật liệu dễ trầy xước khác- Tránh tổn thương chân khi vô tình va quẹt vào chân chống- Chống lún cát khi dựng xe- Nâng cao tuổi thọ chân chốngĐặc tính kỹ thuật- Độ mài mòn: 0,7 cm3/1,61- Độ cứng: 80±5 Shore A- Công dụng:Dùng để lót phía dưới chân chống xe gắn máy, tránh trầy xước khi đậu xe trên nền gạch men hoặc các vật liệu dễ trầy xước khác. Đặc biệt tránh tổn thương chân khi dắt xe mà quên gạt chân chống. Bảo vệ chân chống không bị mòn.Cách sử dụng Đế cao su bọc chân chống xe máy : Gắn miếng lót vào chân chống. Dùng dây rút để cố định miếng lótSản phẩm có lỗ thoát nướcĐóng gói sản phẩm bao gồm:1 x Đế cao su bọc chân chống xe máy#de #cao #su #boc #chan #chong #xe #may"
"https://down-vn.img.susercontent.com/file/vn-11134207-7ras8-m41tfdu8zfds80@resize_w900_nl.webp","Công tắc đỏ Đề, Xi nhan Hazard, Passing, Kèn bầu, Pha cos, Tắt đèn xe, ilding stop cho xe wave , vision...","4.7","2,1k","₫5.980 - ₫12.600","₫8.868 - ₫16.800","6606","Công Tắc Màu Đỏ Các Loại Công Tắc Hình Thanh-30mm-Công tắc Cos Pha Xe Đời Mới-Passing-Tạm Dừng-Nút Đè Wave Xe hondaCongracing88 Xin Kính Chào Quý KháchShop Luôn mang tới những sản phẩm chất lượng nhất có thểhàng cam kết uy tín 100% như hình ảnh có bảo hành đầy đủCongracing88 :✅ Hàng chính hãng 100% lấy tại nguồn nhà phân phối✅ Mẫu mã sản phẩm đẹp, mới 100%✅ Sản phẩm giống hình do shop tự chụp, đúng mô tả sản phẩm 100%✅ Bảo hành lâu dài✅ Đổi trả theo đúng quy định của Shopee:+ Bảo hành 6 tháng với sản phẩm, hỗ trợ đổi trả miễn phí trong 7 ngày+ Chất lượng sản phẩm được kiểm định kĩ lưỡng trước khi gửi cho Quý khách"
"https://down-vn.img.susercontent.com/file/vn-11110105-6khwa-m70x4wbqsxtk99_cover@resize_w164_nl.webp","【Sticker 3D Phong Cảnh】DIY Hình Dán 3D Đa Tầng Nhiều Chủ Đề Dễ Thương  Giấy Thêu Sò Chống Thấm Nước  Bộ 3 Miếng","4.9","4,6k","₫11.399","₫11.999","3285","[Về sản phẩm]◾ Loại: Hình dán◾ Kích thước gói: 150 * 125 mm◾ Chất liệu: PET◾ Số lượng 3 chiếc: Nhãn dán / 2 chiếc & Giấy nền / 1 chiếc◾ Số lượng 2 chiếc: Nhãn dán / 1 chiếc & Giấy nền / 1 chiếc◾ Mẫu: ST531[Về hậu cần]◾ Thời gian giao hàng: trong vòng 24 giờ (Trừ Chủ Nhật)◾ Thời gian giao hàng: 1 ngày◾ Gửi hàng từ: Thành phố Hồ Chí Minh[Giới thiệu về cửa hàng]◾ Tất cả các sản phẩm bạn có thể mua đều là hàng sẵn sàng◾ Dịch vụ khách hàng: 9: 00-18: 00 (Thứ Hai đến Thứ Sáu)[Chú ý mua sắm]◾ Vui lòng cho phép lỗi 1-3mm do đo lường thủ công◾ Màu sắc có thể khác nhau khi hiển thị sự khác biệt"
"https://down-vn.img.susercontent.com/file/sg-11110106-6kipe-m628ufiqyoacbc_cover@resize_w164_nl.webp","Mèo Đen Móc Khóa Sang Trọng Mèo Con Móc Khóa Hoạt Hình Kính Mèo Túi Mặt Dây Quà Tặng","4.8","3,1k","₫16.170","₫16.500","127067","Các tính năng:1. Chất liệu: Mặt dây chuyền mèo con này được làm từ chất liệu bông PP + ngắn sang trọng cao cấp, bề mặt mịn và mềm mại, tạo cảm giác thoải mái, công nghệ tinh tế, bền, an toàn và không độc hại.2. Thiết kế: Thiết kế yếu tố mèo đen nhỏ dễ thương, với khăn quàng cổ, cổ áo, kính bơi và ghi-ta và các yếu tố khác, sinh động và thú vị, phong cách và linh hoạt, là một vật trang trí tốt.3. Dễ dàng treo: Mỗi mặt dây chuyền có một dây chuyền ở trên cùng có thể dễ dàng treo vào túi xách, móc chìa khóa hoặc bất cứ nơi nào bạn thích.4. Nhân dịp: các loại mặt dây chuyền túi xách, mặt dây chuyền chìa khóa, mặt dây chuyền quần áo, mặt dây chuyền vỏ điện thoại,... cũng có thể dùng làm quà tặng cho người thân, bạn bè.Chú ý: Màu sắc thực tế có thể hơi khác so với hình ảnh trên do màu sắc khác nhau được máy tính hiển thị. Cảm ơn bạn cho sự hiểu biết của bạn.Màu đenChất liệu: ngắn sang trọng + bông PPSố: YC0570Kích thước: Như hình ảnhVui lòng cho phép sai số 0,5-1 inch do đo lường thủ công.Gói bao gồm: Móc chìa khóa * 1 CÁI"
"https://down-vn.img.susercontent.com/file/vn-11110105-7r98o-lvgz9mqrffuwc3@resize_w164_nl.webp","Bút đánh dấu lỗ sâu đa năng chiều dài 20mm dùng trong làm gỗ cơ khí phòng tắm xây dựng","4.8","57,3k","₫3.099 - ₫3.870","₫4.500","2283","Bút đánh dấu lỗ sâu đa năng chiều dài 20mm dùng trong làm kỹ thuật gỗ cơ khí phòng tắm xây dựngMô tả:Bút lỗ sâu này được thiết kế với đầu 0,79 ""/ 20mm để dễ dàng khắc sâu vào các lỗ sâu hoặc những nơi khó tiếp cận để dễ dàng sử dụng.Sử dụng chất liệu tốt, cây bút của thợ mộc này chắc chắn và lâu dài; thân dài và đầu nhọn mỏng và tròn, giúp bạn dễ dàng cầm nắm.Thích hợp để đánh dấu vị trí của các lỗ khoan trong đồ nội thất, giá sách hoặc đế đèn. Nó cũng có thể được sử dụng trong gia công phần cứng, sản xuất xe hơi và sản xuất công nghiệp khác, nơi bắt buộc các lỗ sâu để tạo vết. Hoặc có thể được sử dụng để đánh dấu bề mặt của kim loại, gỗ, thủy tinh và các đồ vật khác.Thông tin chi tiết:Chất liệu : NhựaKích thước: 140mm * 9mmSố lượng: 1 sản phẩmGói hàng bao gồm:1 * Bút đánh dấu lỗ sâuCách sử dụng : vẽ trực tiêp lên bề mặt cần đánh dấu.#Bút đánh dấu lỗ sâu#Bút đánh dấu giá rẻ"
"https://down-vn.img.susercontent.com/file/vn-11110105-6khwj-m54a9ocl3brr7f_cover@resize_w164_nl.webp","Bọc bảo vệ thẻ căn cước công dân, thẻ ngân hàng, thẻ tín dụng, bằng lái xe không thấm nước","4.7","5,9k","₫1.000","₫2.000","1162926","Vỏ bọc căn cước công dân , bao túi đựng thẻ CMND, học sinh viên, bằng lái, bảo hiểm y tế, ATM, name card visit, cccdCHỐNG RÁCH: chất liệu PVC dẻo chống rách2 MẶT TRONG SUỐT: giúp bạn dễ dàng thấy thông tin bên trong mà không cần phải mở vỏ bọcĐA NĂNG: Sản phẩm giúp bảo quản các loại thẻ quan trọng ( Thẻ ATM , CM.ND loại plastic thẻ mới, Bằng Lái Xe loại plastic , Card visit... )CHỐNG TRẦY XƯỚC: Giúp giấy tờ của bạn luôn mới tránh bị trầy xước do va chạm với nhauChất liệu: Nhựa PVC dẻo mềmKích thước: 9,3 x 6cm ( +-  1cm )Xuất xứ: Trung QuốcCảm ơn bạn rất nhiều vì đã ghé thăm cửa hàng của chúng tôi. Chúc bạn mua sắm ưng ý tại cửa hàng của chúng tôi."
"https://down-vn.img.susercontent.com/file/vn-11110107-7r98o-lvosw1hpanaxb8@resize_w164_nl.webp","Bút gel Hanii -bút bi văn phòng ngòi viết 0.5mm đều nét chữ đủ màu NAMSHOP","4.7","585,7k","₫0","₫1.000","72019","-------------------THÔNG TIN SẢN PHẨM- Tên sản phẩm: Bút mực nước ngòi viết 0.5mm- Kích thước: Dài 17cm- Chất liệu: Nhựa- Nét to 0.5mm- Màu sắc: Giao ngẫu nhiênĐẶC ĐIỂM NỔI BẬT- Thiết kế ngòi bút 0,5mm- Thân bút vừa vặn- Mực ra đều và liên tục- Bút bi dạng gel nước viết cực trơn- Bút nước mini luôn là bạn đồng hành cho mọi người- Bút viết không lem mực mực ra đềuTHÔNG TIN HÀNG HÓA- Xuất Sứ : Sản Xuất Tại Trung Quốc- Cảnh Báo : Tránh xa tầm tay trẻ em,------------------------☼ Tất cả các sản phẩm tại cửa hàng đều có sẵn nên việc giao hàng cho đơn vị vận chuyển sẽ rất nhanh. Tuy nhiên, thời điểm nhận hàng còn phụ thuộc vào tốc độ giao hàng của đvvc nữa nên mong quý khách thông cảm nếu nhận được đơn hàng muộn hơn dự kiến !☼ Chúng tôi sẽ kiểm tra cẩn thận sản phẩm trước khi gửi đi, nếu sản phẩm bị hư hỏng vì bất kỳ lý do gì, xin vui lòng liên hệ với chúng tôi kịp thời, chúng tôi chắc chắn sẽ giải quyết vấn đề của bạn nhanh nhất có thể.☼ Khi đặt hàng quý khách vui lòng kiểm tra đầy đủ thông tin người nhận (số điện thoại, địa chỉ,…) để tránh sai sót trong quá trình giao nhận ạ.☼ Nếu hài lòng với sản phẩm, hãy “tặng” cho shop đánh giá 5 sao để shop được phục vụ quý khách tốt hơn trong những lần tiếp theo nhé.#but #bi #muc #butbi #butbimuc #butmuc #vanphongpham #do #xanh #den #butbixanh #butbiden #butbido #butxanh #butdo #butdenii"
"https://down-vn.img.susercontent.com/file/vn-11134207-7ra0g-m8on3bk9bdri29@resize_w900_nl.webp","Hộp đựng quà HUFUHOLIC hộp HPBD Giữ chuỗi Đồng hồ Vinaiuem tự gấp hộp thùng trái cây hoa quả Juicy Lasting Tint có seal","4.8","4,3k","₫50.000 - ₫200.000","NULL","816","🎂HỘP HPBD (HAPPY BIRTHDAY)🕯️- Hộp đựng quà có kích thước 17x6x3cm.- Hộp đựng quà để trang trí hoặc tặng bạn bè, người yêu.⌚HỘP ĐỒNG HỒ THỜI GIAN⏰- Hộp đựng quà có kích thước 21x21x4cm.- Hộp đựng quà để trang trí hoặc tặng bạn bè, người yêu.- Hộp k kèm ảnh in.🔥HỘP GIỮ CHUỖI✨- Hộp đựng quà có kích thước 17x6x3cm.- Hộp đựng quà để trang trí hoặc tặng bạn bè, người yêu.❤️HỘP ĐỰNG QUÀ HOÀN HẢO, VINAIUEM, HEHEHE, ADIDOGS💙- Hộp đựng quà có kích thước 22x15x6cm.- Phần để ảnh có kích thước 6x9cm.- Hộp đựng quà để trang trí hoặc tặng bạn bè, người yêu.🍓HỘP ĐỰNG QUÀ BY HUFUHOLIC THÙNG TRÁI CÂY HOA QUẢ JUICY LASTING TINT🍒- Hộp đựng quà có kích thước 22x15x4cm.- Phần để ảnh có kích thước 6x9cm.- Hộp đựng quà để trang trí hoặc tặng bạn bè, người yêu.❌ LƯU Ý: DO TRONG QUÁ TRÌNH VẬN CHUYỂN HỘP GẤP SẴN CÓ THỂ BỊ MÓP NÊN BẠN VUI LÒNG TỰ GẤP HỘP (SHOP CÓ CLIP HƯỚNG DẪN GẤP HỘP)Vui lòng đọc kỹ mô tả sản phẩm, xem kỹ hình ảnh sản phẩm và lựa chọn phân loại sản phẩm bạn muốn mua.Hộp đựng quà đều có seal nếu đã bóc seal shop không hỗ trợ đổi trả hàng với bất kỳ trường hợp nào.Đối với hàng hư hỏng bể vỡ / lỗi sản phẩm / giao sai thiếu quà hay sản phẩm nghi ngờ ở kho hoặc vận chuyển, Hufuholic sẽ chỉ giải quyết cho những khách hàng cung cấp hình chụp và video quay lại quá trình khui kiện hàng (còn nguyên vẹn) đủ 6 mặt."
"https://down-vn.img.susercontent.com/file/vn-11110105-6khwd-m61fu762tglz9b_cover@resize_w164_nl.webp","Set 100 Miếng Dán Trang Trí Sổ Tay DIY Dễ Thương Xinh Xắn Dành Cho Bé, Sticker Trang Trí Vở","4.7","5,8k","₫2.000","₫5.600","33157","Set 100 Miếng Dán Trang Trí Sổ Tay DIY Dễ Thương Xinh Xắn Dành Cho Bé, Sticker Trang Trí Vở16k = 100 tấm với nhiều hình khác nhau - 1 tấm có từ 20-35 hình nhỏ tuỳ mẫuSet combo 100 tấm sticker dán cute trang trí toploader, trang trí móc khoá handmade, trang trí ốp lưng, dán hộp bút, nhãn vở, trang trí, decor- Set /100 tấm sticker đầy đủ mẫu mã- 1 tấm có từ 20-35 hình nhỏ- Sticker nhấp nhánh không phải loại trơn khách yêu nhé- KT: 4*13cm#stickerdan #sticker #nhandansticker"
"https://down-vn.img.susercontent.com/file/d6ad8a87076cca79a035e4079d5501f7@resize_w164_nl.webp","Bút bi Bút mực xanh đen đỏ cute mực nước hình dễ thương cao cấp viết đẹp có nắp giá rẻ Ngòi 0,5mm","4.7","115,2k","₫0","₫1.000","102991","Bút bi xanh đen đỏ cute mực nước hình dễ thương cao cấp viết đẹp có nắp• Loại sản phẩm: Bút bi• Màu mực : Xanh, đen, đỏ• Size ngòi: 0.5mm. Chữ đẹp, Mực trơn, đều.• Chất liệu, thiết kế: bút làm bằng nhựa tốt, cứng cáp, bền chắc.Chất liệu mực chất lượng, đậm nét, đều màu.• Tạo hình nhiều màu sắc gắn trên thân bút đẹp mắt, dễ thương, trở thành điểm nhấn vô cùng độc đáo và nổi bật, màu sắc hài hòa, tươi sáng.• Thích hợp làm quà tặng• An toàn khi sử dụng♥️ Bảo hành: Không bảo hành"
"https://down-vn.img.susercontent.com/file/vn-11110105-7r98o-m05e84bgnqp171@resize_w164_nl.webp","🐾 Poppyjoy Bọc Chống Xước Chip Căn Cước Công Dân, Bảo Vệ, Chống Trầy CMND, ATM, Trong Suốt Chống Trầy Có Nắp Bảo Vệ Thẻ","4.7","51,7k","₫1.100","₫1.859","7459","Tính năngChống từ tính, chứng minh thư, chống mài mòn, PVC, thẻ xe buýt, thẻ ngân hàng trong suốtChất liệu: pvcKích thước: 9 * 6.3cmGói bao gồm1 x Bìa thẻKhông CÓ Hộp Bán Lẻ. Đóng gói an toàn trong túi OPP.Lưu ý:Có thể có một số khác biệt nhỏ trong tông màu của hình ảnh và mặt hàng thực tế.Xin vui lòng cho phép 1-2mm khác biệt do đo lường thủ công, cảm ơn."
"https://down-vn.img.susercontent.com/file/sg-11110105-7rd5d-luzygo3h4erbc6@resize_w164_nl.webp","Bút Gel Có Thể Thu Vào Trong Suốt ST Đầu Đen / Xanh / Đỏ Mực Viết Văn Phòng 0.5 mm Có Thể Thay Thế Nạp Đồ Dùng Học Tập Bút Thi","4.8","533,1k","₫1.100 - ₫3.200","₫1.870 - ₫6.050","2011024","🛒Chào mừng đến với KugoMall!📦Hàng sẵn sàng ở Trung Quốc✔️🚚Chúng tôi sẽ xuất xưởng trong vòng 1-2 ngày làm việc, mất 7-15 ngày làm việc để đến nơi cho bạn.✔️📣Thông tin sản phẩm🔹Mẹo: ST Nib 0.5mm🔹Kích thước bút: 14cm🔹Refill màu: Đen / Đỏ / Xanh dương🔹Số lượng: 1pc⚠️⚠️Lời khuyên ấm áp:1.Do hiệu ứng ánh sáng và màn hình, màu sắc có thể có sự khác biệt nhỏ.2.Xin vui lòng cho phép các lỗi kích thước nhỏ do đo lường thủ công.   Cảm ơn bạn đã hiểu!🌹🌹"
"https://down-vn.img.susercontent.com/file/sg-11110105-6khym-m49sxjg3u3k3d1_cover@resize_w164_nl.webp","TheMall Bút mực nước gel ngòi siêu lớn trong suốt bút bi đen xanh đỏ","4.8","19,6k","₫1.089","₫2.200","278460","🌈Chào mừng đến với TheMall🥳🛒Thông tin sản phẩm:🔸Kích thước: 15 cm🔸Chiều rộng dòng: 0,5mm🔸Màu mực: Xanh / Đỏ / Đen🔸Chất liệu: Nhựa🔸Trọng lượng: 7g✨Giới thiệu sản phẩm🔸Mực dung lượng lớn, một bút tương đương với bốn bút🔸Chữ viết mượt mà và trôi chảy📣Ghi chú sản phẩm:⚠️Tất cả các sản phẩm được đo bằng tay, với sai số 1-2cm. Vui lòng tham khảo sản phẩm thực tế!⚠️Do các cảnh quay khác nhau. Có thể có sự khác biệt nhỏ về màu sắc giữa hình ảnh và sản phẩm thực tế, vui lòng tham khảo sản phẩm thực tế!🚚Giao hàng trọn gói:✔Giao hàng trong 1-2 ngày sau khi xác nhận một đơn đặt hàng;✔Chúng tôi sẽ kiểm tra tất cả các gói hàng trước khi vận chuyển;✔Bạn sẽ nhận được gói trong 5-7 ngày, cảm ơn bạn đã kiên nhẫn."
"https://down-vn.img.susercontent.com/file/vn-11110105-7r98o-m001j6bg9uxp4e@resize_w164_nl.webp","🍥jellycuty🍥Móc Khóa Hình Cậu Bé Bút Chì Shin-chan Bằng Acrylic Trong Suốt Dễ Thương","4.7","38,7k","₫1.639 - ₫4.280","₫1.939 - ₫6.206","5786","Phim hoạt hình Anime Đồ lưu niệm Trang trí hai lớp Móc khóa Acrylic dễ thương Mặt dây chuyền Shin-chanTính năngBút chì màu Shin-chan, Hai lớp, Đáng yêu, Bền, Di động, Trong suốt, Tinh tếHoa văn tinh tế: Những ai theo đuổi bút chì màu shin-chan không được bỏ lỡ chiếc móc khóa này, vì nó có thể thể hiện tình yêu của bạn dành cho bút chì màu shin-chan với người khác. Hoặc những người đam mê anime khác cũng có thể sử dụng nó để sưu tầm và thể hiện tình yêu sâu sắc của họ đối với anime.Thiết kế nhỏ gọn: Trọng lượng nhẹ, trọng lượng nhẹ, dễ mang theo, chiếm không gian nhỏ, dễ sử dụng, không dễ thất lạc. Bề mặt của acrylic sẽ không gây trầy xước cho túi xách và các vật dụng khác của bạn, vì vậy bạn có thể yên tâm sử dụng.Đa năng: Có thể dùng làm móc chìa khóa, đồ trang trí, đồ chơi. Loại hoa văn dễ thương. Nó hoàn hảo cho trường học, văn phòng, sử dụng tại nhà, hoặc làm quà tặng cho trẻ em, bạn bè hoặc bộ sưu tập cá nhân của bạn.Đặc điểm kỹ thuậtChất liệu: AcrylicKích thước gói hàng: 5 x 4 x 0.5cmGói bao gồm1 x Chuỗi khóaKhông CÓ Hộp Bán Lẻ. Đóng gói an toàn trong túi.Lưu ý:Có thể có một số khác biệt nhỏ trong tông màu của hình ảnh và mặt hàng thực tế.Xin vui lòng cho phép 1-2mm khác biệt do đo lường thủ công, cảm ơn."
"https://down-vn.img.susercontent.com/file/vn-11110105-6khwa-m64wjojpi2ie8c_cover@resize_w164_nl.webp","Balo nữ balo nam giá rẻ thời trang đi học đựng laptop phong cách basic ulzzang BL3","5.0","144","₫1.000","NULL","19860","LƯU Ý: BALO KHÔNG KÈM MÓC KHÓA1.Balo nam, balo nữ giá rẻ thời trang đi học đựng laptop phong cách basic ulzzang Hàn Quốc- Màu sắc: Đen, Be, Xanh Dương- Chất liệu: Vải chuẩn Polyste sơi dù chuyên dụng được dùng làm cho balo thời trang cao cấp/xuất khẩu2. Công dụng của Balo nam, balo nữ giá rẻ thời trang đi học đựng laptop phong cách basic ulzzang Hàn Quốc- Balo NAM basic với thiết kế rất nhiều ngăn. 1 ngăn lớn đựng thoải mái A4 (bên trong tích hợp  1 ngăn đựng laptop, 1 ngăn kéo khoá nhỏ cùng nhiều ngăn phụ nhỏ để bút, ví, thẻ atm.v.v...khá là tiện dụng- Mặt trước balo gồm 1 ngăn nhỏ tiện lợi- 2 bên hông balo có 2 ngăn phụ đựng chai nước,- Balo ulzzang basic với thiết kế trẻ trung, năng động và hiện đại. Balo k chỉ để đi học, đi làm, đi chơi thông thường mà nó còn như 1 món phụ kiện giúp định hình phong cách và cá tính người đeo3. CAM KẾT khi mua Balo nam, balo nữ giá rẻ thời trang đi học đựng laptop phong cách basic ulzzang Hàn Quốc- Liên tục cập nhật những mẫu balo mới nhất với giá cả rẻ nhất để khách hàng lựa chọn.- Giao hàng trong thời gian ngắn nhất.- Được đổi trả 1 đổi 1 hoàn toàn miễn phí nếu sản phẩm khi nhận hàng bị vỡ - hỏng – không giống hình ảnh.- Hỗ trợ giải quyết đơn hàng trong thời gian sớm nhất với phương án tốt nhất để khách hàng luôn cảm thấy hài lòng và yên tâm khi mua sắm.4. LƯU Ý khi mua Balo nam, balo nữ giá rẻ thời trang đi học đựng laptop phong cách basic ulzzang Hàn Quốc- Màu của balo có thể sẽ chênh lệch thực tế một phần nhỏ, do ảnh hưởng về độ lệch màu của ánh sáng nhưng vẫn đảm bảo chất lượng- Shop chỉ giải quyết những khiếu nại của khách hàng khi có bằng chứng rõ ràng ( Quay video khi nhận hàng bóc hàng, phiếu giao hàng của bên shop..)Click đặt hàng ngay để sở hữu cho mình Balo nam, balo nữ giá rẻ thời trang đi học đựng laptop phong cách basic ulzzang Hàn Quốc này trong thời gian còn khuyến mãi nhé!#balo #balonu #balothoitrang #balochongnuoc #baloulzzang #balodihoc #balonam #balothoitrangnu #balohanquoc #balovaidu #balonuhanquoc #balobasic #balonam #balounisex #balodulich #balophuot #balodichoi #balogiare #balocatinh #balonhieungan #balotibi #balotibihologram #balomauden #balobasic #balo #thoi #trang #nam #nu #tibi #balonhieungan #baloden #baloulzzangdep #balonugiare #balonudepgiare #balonudihoc #balodihocthoitrang #balonudepgiare"
"https://down-vn.img.susercontent.com/file/vn-11134207-7r98o-luudr1fb553m41@resize_w900_nl.webp","Ví Nam vải Canvas chống nước chống xước. Combo Ví Vải phong cách trẻ trung năng động & Bọc CCCD DODANA VNCV","4.8","6,2k","₫1.900","₫10.000","792978","1, THÔNG TIN SẢN PHẨM:- Tên sản phẩm: Ví nam đẹp kiểu ví ngang có hộp nhiều ngăn, Bóp vải cầm tay gấp gọn đang năng thời trang trẻ trung cho nam - VNCV- Màu sắc của ví: Nâu Đậm, Nâu Nhạt, Đen- Kích thước: 11,5cm(cao) x 9cm(rộng) x 1,7cm(dày)- Chức năng :+ 2 Ngăn đựng tiền chính+ 4 Ngăn đựng thẻ+ 1 ngăn đựng sim. thẻ nhớ2, CHÍNH SÁCH BẢO HÀNH :- Sản phẩm được bảo hành 12 tháng chất lượng da và các lỗi do nhà sản xuất- Đổi trả hàng miễn phí trong vòng 7 ngày kể từ ngày nhận được hàng với các lỗi kĩ thuật hoặc gửi sai hàng*LƯU Ý:+ Bóp nam khi đổi trả phải còn mới, nguyên vẹn và chưa qua sử dụng+ Xử lý sự cố trong quá trình vận chuyển bị hư hỏng hoặc phát nhầm sản phẩm, quý khách hàng vui lòng chụp ảnh sản phẩm, chúng tôi sẽ xử lý, giải quyết vấn đề nhanh nhất.3, CAM KẾT VỚI KHÁCH HÀNG- 100% video, hình ảnh do đội ngũ tự sản xuất- Ví nam được thiết kế và sản xuất trực tiếp tại xưởng ở Việt Nam- Hàng sẵn giao liền khi nhận đơn- Giao hàng hỏa tốc tại Hà Nội- Bảo hành và đổi trả theo quy định của ShopeeMọi vấn đề thắc mắc về sản phẩm hoặc các vần đề phát sinh về hàng hóa xin quý khách vui lòng liên hệ qua phần Chat#vi #vinam #vidanam #bopnam #vinamcaocap #vinamdabo #vinamdabothat #tuivinam # vidungnam #vinamdep #vinamdangdung #vinamdangnang #vitiennam\"
"https://down-vn.img.susercontent.com/file/dd79e040727bf6ad0fbae2fad2b0ae7d@resize_w164_nl.webp","Ví nam , bóp nam dáng đứng vải canvas kiểu dáng thời trang hàn quốc nhỏ gọn","4.8","10,3k","₫5.000 - ₫41.000","₫20.000 - ₫80.000","288826","Ví nam Jolizeon cao cấp,Ví da nam dáng đứng đựng tiền và thẻ mini nhỏ gọn ,Có hộp đẹp chấtVí Nam JOLIZEON VỚI PHONG CÁCH TRẺ TRUNG NĂNG ĐỘNG VÀ CŨNG KHÔNG KÉM PHẦN SANG TRỌNG ĐÃ CẬP BẾN✔ THÔNG TIN SẢN PHẨM:- Tên sản phẩm: Ví da nam JOLIZEON- Ví dáng đứng có xuất xứ Hàn Quốc- Chất liệu: Ví da lộn cao cấp, đường may tỉ mỉ chắc chắn và bền bỉ ,bề mặt da không thấm nước.- Vật liệu:da lộn✔ CHI TIẾT SẢN PHẨM:- Màu sắc của ví: Xám,Đen- Khối lượng : 40g- Kích thước: 11.3cm(cao) x 8.7cm(rộng) x 0.6cm(dày)- Ví nam có 1 ngăn đựng tiền chính, 5 ngăn đựng thẻ ATM, bằng lái xe và đầy đủ ngăn để Giấy tờ xe – CMND- Ví cầm tay nam, ví dáng đứng được thiết kế nhỏ gọn với chất da bền bỉ, không thấm nước…- Ví nam phong cách trẻ trung năng động cho anh em thêm tự tin mỗi khi ra ngoài, ví cũng thích hợp cho chị em làm quà tặng người yêu- Ví đựng thẻ nam: Thẻ ATM, CCCD vô cùng tiện lợi✔ LỢI ÍCH KHÁCH HÀNG KHI MUA CÁC SẢN PHẨM : (5 được)+ Được mua sản phẩm với giá cả hợp lí+ Được hỗ trợ phí giao hàng+ Được tặng kèm hộp đựng hoặc quà+ Được đóng gói chuyên nghiệp, hộp đựng sản phẩm sang trọng+ Được shop hỗ trợ tư vấn, chăm sóc 24/24 các vấn đề về sản phẩm, cam kết, bảo hành, đổi trả."
