"Image","Name","Rate Star","Sold","Selling Price","Original Price","Available Product","Description"
"https://down-vn.img.susercontent.com/file/vn-11134207-7ra0g-m6i7vntm66go95@resize_w900_nl.webp","Switch Crystal xuyên led trục linear nhựa PC sử dụng cho bàn phím cơ","4.9","3,1k","₫2.300 - ₫3.500","₫3.000 - ₫5.000","5487","Switch Crystal xuyên led trục linear nhựa PC sử dụng cho bàn phím cơ* ẢNH SẢN PHẨM DO SHOP CHỤP THỰC TẾThông số:- Trục Linear- Chất liệu: PC- Overall length: 0,35cm- Trigger length: 0,16cm-Trigger Pressure: 45+-5g- Total pressure: 5+-5gSwitch Crystal PC là một loại switch cơ học được thiết kế với housing (vỏ) làm từ nhựa Polycarbonate (PC) trong suốt, mang lại hiệu ứng ánh sáng LED rực rỡ và rõ nét hơn so với các loại switch thông thường. Dưới đây là một số đặc điểm nổi bật của loại switch này:Đặc điểm chính:Vỏ Polycarbonate trong suốt: Giúp ánh sáng LED xuyên qua tốt hơn, tạo hiệu ứng RGB đẹp mắt.Cảm giác gõ mượt mà: Nhờ chất liệu PC cứng và bề mặt nhẵn, switch mang lại độ ma sát thấp, giúp hành trình gõ trơn tru hơn.Độ bền cao: Polycarbonate là một vật liệu bền, giúp switch có tuổi thọ cao hơn so với nhựa ABS hoặc POM.Âm thanh trong và sắc nét: Chất liệu PC thường tạo ra âm thanh gõ vang và rõ hơn, phù hợp với những ai thích âm thanh clack nhưng không ồn như dòng clickyTương thích với nhiều loại keycap: Do có housing tiêu chuẩn, switch Crystal PC có thể được sử dụng với hầu hết các bộ keycap trên thị trường.Ứng dụng:Phù hợp với bàn phím có LED RGB, giúp ánh sáng tỏa đều và nổi bật.Thích hợp cho cả gaming và gõ văn bản nhờ cảm giác gõ mượt mà.Dành cho người dùng thích hiệu ứng ánh sáng và độ bền cao của switch PC."
"https://down-vn.img.susercontent.com/file/vn-11110105-7r98o-lo3hnkdhmtgt75@resize_w164_nl.webp","Lót chuột CỠ LỚN 100 mẫu kích thước 80x30cm pad chuột cao su gaming cỡ lớn speed bo viền chắc chắn","4.9","52,1k","₫10.000","₫20.000","22931","Lót chuột CỠ LỚN 100 mẫu kích thước 80x30cm pad chuột cao su gaming cỡ lớn speed bo viền chắc chắn TechStar🎁 THÔNG TIN LÓT CHUỘT:✅Kiểu dáng hình chữ nhật✅Size : 800x300mm✅Chất liệu : Cao su✅Bề mặt : Trơn - Nhẵn👉 CAM KẾT CỦA SHOP✅Tất cả sản phẩm luôn có sẵn trong kho và được gửi đi trong ngày.✅100% sản phẩm đều được kiểm tra trước khi gửi tới tay khách hàng.✅Sản phẩm giống hình ảnh mô tả 100%.✅100% Sản phẩm đều được kiểm tra cẩn thận trước khi gửi đi.✅15 ngày đổi trả miễn phí vận chuyển theo chính sách của sàn, NẾU SP không giống hình hoặc có lỗi👉 MÔ TẢ LÓT CHUỘT:✅Lót chuột có chất lượng in tốt đảm bảo không phải màu✅Có thể giặt tay, dùng bản chải đánh cho sạch✅Đế chống trơn trượt.✅Giúp việc điều khiển chuột nhanh nhạy và chính xác hơn✅Sợi vải cấu trúc chống bám đặc biệt tối ưu hóa khả năng điều khiển chuột✅Bo viền chống rách tăng độ bền cho bàn di✅Trang trí hình ảnh sinh động, đẹp mắt✅Miếng lót chuột sẽ góp phần không nhỏ vào những thao tác chính xác và nhanh nhẹn với chuột của các game thủ, nhất là các game đòi hỏi thao tác nhanh nhẹn và chính xác.✅Sản phẩm được àm từ sợi vải cấu trúc chống bám đặc biệt tối ưu hóa khả năng điều khiển chuột.✅Đế cao su bám mặt bàn tốt, chống trượt đảm bảo chuột di chuyển mượt mà✅Có thể sử dụng với chuột quang, chuột bi và hầu hết các loại chuột laser thông dụng. Tính năng này giúp bạn sử dụng sản phẩm hiệu quả hơn và không phải thay mới khi thay đổi loại chuột máy tính👉Thời gian giao hàng dự kiến : ( Thời gian giao hàng có thể nhanh hoặc chậm hơn dự kiến)✅1 – 2 ngày  ( Nội thành Hà Nội )✅2 – 4 ngày  (  Các TP lớn – Khu vực gần TP )✅3 – 7 ngày  ( Các khu vực khác )👉Lưu ý : Thời gian giao tính từ ngày shop gửi hàng cho bên vận chuyển👉Chú ý: màu sắc có thể đậm nhạt do mỗi điện thoại máy tính có màn hình độ phân giải và cách hiển thị khác nhau.💌Phản hồi:✅1 Xin vui lòng để lại cho chúng tôi một phản hồi tích cực (5 sao), nếu bạn hài lòng với các mặt hàng của chúng tôi.✅2 Vui lòng liên hệ với chúng tôi trước khi để lại bất kỳ phản hồi tiêu cực hoặc mở một tranh chấp trên Shopee.✅3 Xin vui lòng cho chúng tôi cơ hội để giải quyết bất kỳ vấn đề.#lot_chuot #lót_chuột #pad_chuot #padchuot #bandichuot #tamlotchuot #lotchuotgaming #mienglotchuot #mousepad #lotchuotcolon #lotchuot80x30 #pad #lotbanphim #lotchuotanime #lotchuotmaytinh #phukienmaytinh #thamlotchuot #chuotgaming #chuot #techstar"
"https://down-vn.img.susercontent.com/file/vn-11110105-7r98o-lyndvaishw7rdc@resize_w164_nl.webp","Webcam Có Mic 2K/1080P Máy tính USB Cho PC Laptop Livestream/Họp trực tuyến,  Camera mini, Học và Làm việc Online","4.8","3,6k","₫140.060","₫220.000","9304","📣📣📣2K và 1080P có vẻ giống nhau, nhưng thực tế độ phân giải là 2K. Trên hộp đựng cũng sẽ có dán nhãn 2K. Khi nhận hàng, bạn có thể kiểm tra trước. Nếu không hài lòng, chúng tôi sẽ hoàn lại tiền cho bạn. Mong bạn đừng vội đưa ra đánh giá tiêu cực về chúng tôi. Xin cảm ơn.📣 Mã voucher giảm giá khi theo dõi gian hàng.✔️ Thương hiệu mới trong kho📸📸- Thấu kính: Thấu kính HD 1080P/2K- Màu sắc: Đen- Loại cảm biến: CMOS- Định dạng video: AVI- Tốc độ khung hình: 30FPS- Đặc điểm: Cắm và sử dụng- Chiều dài cáp USB: 120cm- Loại giao diện: USB2.0- Micro: Micro tích hợp- Phạm vi lấy nét: 20mm- Kích thước sản phẩm: 70mm * 50,7mm * 44mm- Thiết bị hỗ trợ: Hỗ trợ các hệ điều hành phổ biến như Windows 2000, XP, Vista, Win7, Win8, Win10, Mac OS, Linux và các hệ điều hành khác- Trọng lượng: 62,8g💕💕Nhưng đặc điểm NỔI BẬT của sản phẩm:- Độ phân giải 2K,1080P, Full HD siêu nét.tự động lấy nét và hiệu chỉnh ánh sáng cho các cuộc gọi video, rất sắc nét.- Có Micro Kép, thu âm tốt.- Hỗ trợ sáng và cân bằng sáng tốt, rất nịnh mắt.- Đầu cắm USB rất thông dụng, không cần cài đặt, cắm vào là sử dụng được ngay.- Đầu nối linh hoạt xoay 360°- Kẹp thông minh dễ dàng cố định ở màn hình.📦Bảng kê hàng hóa：1 * Webcam (Kèm hộp gốc)1 * Hướng dẫn sử dụng#webcam #webcampc #webcamlivestream #webcam2k #webcam4k #webcamfullhd #cammaytinh #campc #webcammaytinh"
"https://down-vn.img.susercontent.com/file/vn-11134207-7r98o-lwjs5b85ume3a1@resize_w900_nl.webp","Tai Nghe Bluetooth Pro 13 Nhét Tai Không Dây Cảm Ứng Chạm Chống Ồn Âm Thanh Tuyệt Đỉnh","4.5","3,6k","₫55.000","₫100.000","824","Tai Nghe Bluetooth Pro 13 Nhét Tai Không Dây Cảm Ứng Chạm Chống Ồn Âm Thanh Tuyệt Đỉnh🔰 MÔ TẢ SẢN PHẨM• Chip mới nhất• Vi trình mới nhất• Màng loa cải thiện. Cho chất lượng âm thanh hay hơn.• Dung lượng pin cao hơn so với các bản cũ.• Bo mạch. Bảo vệ nguồn Dock sạc.• Theo dõi được % pin• Cảm biến tiệm cận _ Cảm biến nhiệt. Khắc phục delay cho tai nghe.🔰Đặc Điểm Tai nghe Bluetooth :* Có cảm biến tháo tai dừng nhạc* Định Vị* Đổi Tên* Bluetooth 5.0* Thời gian sạc: 1 giờ* Nghe liên tục 4 _6 giờ* Pin tai nghe 48mah (có DC bảo vệ pin)* Pin hộp sạc 320mah* Đặc biệt siêu dễ kết nối, hiện cửa sổ ở điện thoại ấn cái được🔰Chức Năng:• Mở nắp là hiện popup, kết nối duy nhất 1 lần.• Mic cực tốt không chút âm tạp, đàm thoại dễ dàng cực thích.• Âm thanh đạt chuẩn 8/10• Tháo tai nghe dừng nhạc, đeo tai nghe tự động phát nhạc.• Cảm ứng cực nhạy.• Đổi tên, định vị, tuỳ chọn cài đặt cảm biến.• Play/Pause _ Next/Back.• Sạc không dây tiện lợi.🔰HƯỚNG DẪN SỬ DỤNG :Bước 1: Mở nắp thiết bị và rút đồng thời 2 tai nghe ra để gần ĐT của bạnBước 2: ĐT sẽ mở ra cửa sổ yêu cầu kết nối, bạn làm theo hướng dẫn để kết nốiBước 3: Vào cài đặt bluetooth để tùy chỉnh tên và thao tác chạm🔰SẢN PHẨM GỒM CÓ :1. 2 tai nghe (tai trái,tai phải)2. hộp sạc (dock sạc)3. dây sạcHàng tại cửa hàng của chúng tôi đều là hàng có sẵn và sẽ được chuyển ngay sau khi thanh toán, và giao hàng tận nơi toàn quốc .Sản phẩm của chúng tôi là 100% chính hãng và chúng tôi đảm bảo! ! !__________________________CAM KẾT________________________________✔️Về sản phẩm: Cam kết hàng chính hãng 100%✔️Về dịch vụ: Tỉ lệ phản hồi chat 100% , trả lời trong vòng 30p giờ hành chính ,hotline trực giờ hành chính xử lí khiếu nại 100%.✔️Thời gian chuẩn bị hàng: Hàng có sẵn, QK cứ đặt hàng là chúng tôi giao đi, BƯU TÁ lấy hàng vào 2 buổi 11h sáng và 16h.✔️Thời gian giao hàng dự kiến : HCM, Hà Nội, Đà Nẵng sẽ nhanh nhất _ Các tỉnh khác sẽ theo thời gian hiển thị trên đơn hàng.✔️Shop bảo hành đổi trả miễn phí nếu sim không đúng như giới thiệu!___________________________________________________________SHOP CHUYÊN BÁN BUÔN BÁN LẺ:  SIM DATA 4G và THIẾT BỊ MẠNG USB , USB WIFI , BỘ PHÁT WIFI , TAI NGHE , THẺ NHỚ , LOA ...RẤT MONG SỰ ỦNG HỘ CỦA TẤT CẢ MỌI NGƯỜI .Cảm ơn Quý Khách Hàng !#Tainghoigame #tai_nghe_bluetooth #taiingoothbluetoothkhongday #tainghegaming #taiingenroi #taiinghexiaomi #Taixiaomi #tainghe #tainghekoday #tainghebluetooth#tainghe #tainghenhettai #tainghebluetooth #twsd76 #sony #bass #superbass  #bluetooth  #tainghenhettai #tainghevip #tainghehot #tainghegiare #tainghexin #tainghechinhhang #TWS #tainghebluetooth #taibluetooth #airpod #airpo"
"https://down-vn.img.susercontent.com/file/0a34b44d7e3a813b941e9ca4055fd522@resize_w164_nl.webp","Quạt Tản Nhiệt Phản Lực 12-24v Nidec Chính Hãng ( 4x4x2.8)","4.8","4,9k","₫28.000 - ₫46.000","NULL","23464","SẢN PHẨM CÓ DÂY NGẮN DÂY DÀI , CÓ TEM VÀ KHÔNG TEM , BẠN NÊN ĐỌC KỸ TRƯỚC KHI MUAMỖI SẢN PHẨM ĐƯỢC ĐO DÒNG CHÍNH XÁC NHƯ TRÊN ẢNH MÔ TẢ•••••••••••••••••••HƯỚNG DẪN ĐẤU DÂY CHO QUẠT•••••••••••••••••••📣 Loại quạt đôi 12v 3,20aĐấu Dây Đỏ vs Cam Chung là (➕)Đấu Dây Đen vs Xám Chung là (➖)Dây Xanh dương vs xanh lá là điều tốc2 dây còn lại bỏ📣 Loại 4cm 12v 0,45a••Dây xanh vs đỏ là (➕)Dây Đen là (➖)📣 Các loại còn lại••· ĐỎ LÀ DƯƠNG ➕· ĐEN LÀ ÂM ➖· CÁC DÂY CÒN LẠI BỎLƯU Ý CẤP NGUỒN CHO QUẠT-- Pin : phải pin 3s 12v-- Bình acquy : phải bình 12v và chắc chắn gắn đúng cực ➕ ➖ vì sai 1 lần là hư quạt-- Nguồn Adapter : phải 12v ampe phải cao hơn hoặc bằng với thông số quạtTuyệt đối không được sử dụng các loại triết áp, hạ áp vì không có tác dụng với quạt ( nếu ae rành thích trải nghiệm cứ thử nhưng shop sẽ không bảo hành )🎥 VUI LÒNG QUAY LẠI VIDEO THỂ HIỆN RÕ MÃ ĐƠN HÀNG ĐỊA CHỈ ĐỂ BỔ SUNG BẰNG CHỨNG SẢN PHẨM LỖI ĐỂ ĐƯỢC SHOP BẢO HÀNG NHANH CHỐNG NHẤT"
"https://down-vn.img.susercontent.com/file/vn-11110105-7r98o-lv1dfkejmxym96@resize_w164_nl.webp","Bộ Dụng Cụ Vệ Sinh Laptop Máy Tính SMTech Bộ Vệ Sinh Bàn Phím Màn Hình Tai Nghe Điện Thoại Nhỏ Gọn","4.8","33,2k","₫18.000","₫28.000","1786169","Bộ vệ sinh đa năng, có thể dễ dàng vệ sinh được nhiều loại thiết bị: máy tính, laptop, tai nghe, điện thoại, bàn phím... Nhựa ABS cao cấp, chống va đập. Thiết kế nhỏ gọn, dễ dàng mang theo bên mìnhTHÔNG TIN CHI TIẾT SẢN PHẨM- Lọ dung dịch đi kèm chỉ 10ml nên bạn có thể mua thêm lọ dung dịch 30ml để chiết khi hết hoặc dùng nước lau kính.- Chất liệu: Nhựa ABS siêu bền- Sản phẩm bộ vệ sinh 7in1 bao gồm:+ 1 Bút vệ sinh 3 trong 1+ 1 bàn chải lông mềm mịn+ 1 dụng cụ tháo bàn phím+ 1 bình nước dung dịch vệ sinh+ 1 vải lau chuyên dụng- Kích thước: 15x4x6cm#bovesinh #dungcuvesinh #bovesinhmaytinh #bovesinhlaptop #bovesinhtainghe #bovesinhairpod #bovesinhbanphim #dungcuvesinhlaptop #vesinhamytinh #vesinhlaptop #vesinhtainghe #vesinhbanphim #vệ_sinh_tai_nghe#cách_vệ_sinh_tai_nghe#cách_vệ_sinh_tai_nghe_airpod#vệ_sinh_tai_nghe_airpod#cách_vệ_sinh_tai_nghe_chụp_tai#cách_vệ_sinh_tai_nghe_có_dây#vệ_sinh_tai_nghe_iphone#vệ_sinh_tai_nghe_chụp_tai#cách_vệ_sinh_tai_nghe_gaming#vệ_sinh_tai_nghe_bluetooth#cách_vệ_sinh_tai_nghe_máy_tính#dịch_vụ_vệ_sinh_tai_nghe_airpod#vệ_sinh_tai_nghe_in_ear#vệ_sinh_tai_nghe_đúng_cách+ Bộ Dụng Cụ Vệ Sinh Laptop - Máy tính - Bàn Phím - Tai Nghe Airpod Đa Năng 7 in 1 Siêu Nhỏ Gọn+ Bộ dụng cụ vệ sinh laptop - máy tính - bàn phím - tai nghe airpod - điện thoại gọn nhẹ cầm tay 7 in 1 bản đặc biệt+ vệ sinh bàn phím cơ, cạy bàn phím, vệ sinh bàn phím, bộ vệ sinh tai nghe"
"https://down-vn.img.susercontent.com/file/vn-11110107-7r98o-lz0rtyimstiw1d@resize_w164_nl.webp","Lót chuột cỡ lớn phím tắt văn phòng 100 mẫu pad chuột anime bàn di chuột siêu đẹp bền bảo hành 12 tháng mã Pd1","4.9","6,2k","₫13.000","₫28.000","73226","Lót chuột cỡ lớn phím tắt văn phòng 100 mẫu pad chuột anime bàn di chuột siêu đẹp bền mã Pd1- Miếng lót chuột đáy cao su có may viền bề mặt vải làm tăng cao độ chính xác của chuột.- Pad chuột phù hợp mọi loại chuột,  khổ lớn để phím chuột tại nghe điện thoại thoải mái- Lót chuột siêu bền và phong cách hoàn toàn khác biết với các loại thông thường- Bàn di chuột kiểu dáng hình chữ nhật 80x30 70x30- Thông số kĩ thuật 80x30cm, 70x30cm- Thông tin cảnh báo: không có- Hướng dẫn sử dụng: di chuột, kê bàn phím- Thời gian nhận hàng các thành phố : 1-2 ngày làm việcvùng khác 1-3 ngày làm việcChúng tôi tự hào là đơn vị kinh doanh lót chuột rộng khắp cả nước, rất hân hạnh được phục vụ quý khách (sản phẩm 1 đổi 1 trong 12 tháng)#lotchuot #lotchuotcolon #lotchuotvanphong #pad #lotchuotcute #lotchuotchoigame #Mienglotchuot #gaming #gaminggear #phukienmaytinh #lotbanphim #padchuot #bandichuot #lotchuotanime #moupad #lotchuot80x30 #gear #pdstore9999"
"https://down-vn.img.susercontent.com/file/vn-11134207-7r98o-lqhjt93c10s799@resize_w900_nl.webp","| ROG | Bàn di chuột, Miếng lót chuột - Bề mặt Speed + May bo viền","4.9","5,7k","₫20.000 - ₫70.000","NULL","3659","✨ Bàn di chuột - Miếng lót chuột - Mousepad Speed✨ MÀU ĐEN - DÀY 2mm - 3mm - 4mm - 5mm - KHÁNG NƯỚC - BỀ MẶT SPEED - MAY BO VIỀN👉 Chuyên dùng cho dân văn phòng, học sinh, chơi game cơ bản.⛔ Lưu ý: Shop cung cấp nhiều Size và độ dày mỏng khác nhau nên Quý khách cân nhắc lựa chọn trước khi mua.👉Thông tin sản phẩm:✔️ Tên sản phẩm: Bàn di chuột - Miếng lót chuột - Mousepad Speed✨Màu sắc:✔️Nền màu đen + Logo ROG màu đỏ✔️Nền màu đen + Logo ROG màu trắng✨ Kích thước:✔️Size: 300x250x2mm✔️Size: 300x250x3mm✔️Size: 300x250x4mm✔️Size: 350x300x3mm✔️Size: 350x300x4mm✔️Size: 350x300x5mm👉 Chất liệu bề mặt: Bề mặt làm bằng vải mịn, êm ái, độ ma sát thấp giúp người sử dụng di chuyển nhanh nhạy hơn, cho khả năng xử lí được chính xác hơn. Sử dụng công nghệ in chuyển nhiệt chống phai màu, tối ưu hoá độ chuẩn xác của mắt đọc, tránh tình trạng loss khi di chuột tốc độ cao. Bề mặt thoáng khí và may bo viền.👉 Chất liệu mặt sau: Cao su bọt tự nhiên chống trơn trượt, bạn có thể sử dụng trên nhiều loại mặt phẳng khác từ gỗ, kính,… giúp người dùng khi thao tác chuột, miếng lót không bị xô khỏi vị trí ban đầu và tăng độ êm ái khi đặt tay lên rê chuột."
"https://down-vn.img.susercontent.com/file/vn-11134207-7qukw-lhh535a6ysap5d@resize_w900_nl.webp","Lót chuột nỉ chống trượt, pad chuột nỉ dày 3mm cao cấp size lớn 140x70cm, 120x60cm, 100x50cm...","4.8","2,1k","₫69.500 - ₫170.000","₫139.000 - ₫259.000","2510","Lót chuột nỉ chống trượt, pad chuột nỉ dày 3mm cao cấp size lớn 140x70cm, 120x60cm, 100x50cm...Thông số sản phẩm :-Đủ Size : 140x70 cm, 120x60cm, 100x50cm, 90x40cm, 80x40cm, 70x35cm-Độ dày: 0.3cm-Chất liệu: Mặt trên bằng nỉ, Mặt dưới gắn hạt cao su chống trượt-Bề mặt: Nỉ thô mượt, êm ái, chống xù và cong vênh-Thích hợp với hầu hết tất cả các loại chuột-Chất liệu cao cấp, không bị phải tạp chất, mùi lạ như các sản phẩm khác.-Màu sắc cự kỳ tinh tế, trang nhã phù hợp setup góc làm việc theo phong cách Minimalism.-Thảm to, kín bàn, khiến tông màu bàn trở nên liền mạch, dễ dàng setup các phụ kiện bàn làm việc khác.-Không cần vệ sinh thường xuyên."
"https://down-vn.img.susercontent.com/file/vn-11110105-6khwd-m3eoxsy1nbng41_cover@resize_w164_nl.webp","Lót chuột cỡ lớn họa tiết Typography tối giản đa dạng kích thước, pad chuột gaming chống trơn trượt","4.9","2,1k","₫65.000","₫80.000","2102","Lót chuột cỡ lớn họa tiết Topography tối giản đa dạng kích thước, pad chuột gaming chống trơn trượt🎁 THÔNG TIN LÓT CHUỘT:✅Kiểu dáng hình chữ nhật✅Size : 80x30cm, 90x40cm, 100x50cm✅Chất liệu : Cao su✅Bề mặt : Trơn - Nhẵn👉 CAM KẾT CỦA SHOP✅Tất cả sản phẩm luôn có sẵn trong kho và được gửi đi trong ngày.✅100% sản phẩm đều được kiểm tra trước khi gửi tới tay khách hàng.✅Sản phẩm giống hình ảnh mô tả 100%.✅100% Sản phẩm đều được kiểm tra cẩn thận trước khi gửi đi.✅15 ngày đổi trả miễn phí vận chuyển theo chính sách của sàn, NẾU SP không giống hình hoặc có lỗi👉 MÔ TẢ LÓT CHUỘT:✅Lót chuột có chất lượng in tốt đảm bảo không phải màu✅Có thể giặt tay, dùng bản chải đánh cho sạch✅Đế chống trơn trượt.✅Giúp việc điều khiển chuột nhanh nhạy và chính xác hơn✅Sợi vải cấu trúc chống bám đặc biệt tối ưu hóa khả năng điều khiển chuột✅Bo viền chống rách tăng độ bền cho bàn di✅Trang trí hình ảnh sinh động, đẹp mắt✅Miếng lót chuột sẽ góp phần không nhỏ vào những thao tác chính xác và nhanh nhẹn với chuột của các game thủ, nhất là các game đòi hỏi thao tác nhanh nhẹn và chính xác.✅Sản phẩm được àm từ sợi vải cấu trúc chống bám đặc biệt tối ưu hóa khả năng điều khiển chuột.✅Đế cao su bám mặt bàn tốt, chống trượt đảm bảo chuột di chuyển mượt mà✅Có thể sử dụng với chuột quang, chuột bi và hầu hết các loại chuột laser thông dụng. Tính năng này giúp bạn sử dụng sản phẩm hiệu quả hơn và không phải thay mới khi thay đổi loại chuột máy tính👉Thời gian giao hàng dự kiến : ( Thời gian giao hàng có thể nhanh hoặc chậm hơn dự kiến)✅1 – 2 ngày  ( Nội thành Hà Nội )✅2 – 4 ngày  (  Các TP lớn – Khu vực gần TP )✅3 – 7 ngày  ( Các khu vực khác )👉Lưu ý : Thời gian giao tính từ ngày shop gửi hàng cho bên vận chuyển👉Chú ý: màu sắc có thể đậm nhạt do mỗi điện thoại máy tính có màn hình độ phân giải và cách hiển thị khác nhau.💌Phản hồi:✅1 Xin vui lòng để lại cho chúng tôi một phản hồi tích cực (5 sao), nếu bạn hài lòng với các mặt hàng của chúng tôi.✅2 Vui lòng liên hệ với chúng tôi trước khi để lại bất kỳ phản hồi tiêu cực hoặc mở một tranh chấp trên Shopee.✅3 Xin vui lòng cho chúng tôi cơ hội để giải quyết bất kỳ vấn đề.#lot_chuot #lót_chuột #pad_chuot #padchuot #bandichuot #tamlotchuot #lotchuotgaming #mienglotchuot #mousepad #lotchuotcolon #lotchuot80x30cm #pad #lotbanphim #lotchuotbasic #lotchuotmaytinh #phukienmaytinh #thamlotchuot #chuotgaming #chuot #techstar #lotchuot90x40cm #lotchuot100x50cm #lotchuotminimalism #lotchuottopography"
"https://down-vn.img.susercontent.com/file/578a774340037327d8d8b1ceaa12bbef@resize_w164_nl.webp","Tăm chỉ nha khoa hộp 50 cái, tăm chỉ nha khoa okamura","4.8","3,3tr","₫2.999","₫5.800","428266","Tăm chỉ nha khoa hộp 50 cái, tăm chỉ nha khoa okamura TVV1392Tăm chỉ răng miệng  hộp 50 chiếc khử trùng sợi chỉ mảnh-Tăm chỉ răng miệng DENTAL FLOSSERS là việc phối hợp trên cả tuyệt vời của hai vật phẩm chỉ tơ răng miệng và tăm xỉa răng nha khoa, được xây cất cực kỳ giúp dễ ợt mang đi các mảng bám trong khe răng sẽ là nơi bàn chải tiền lệ khó len vào đến được.-Sử dụng tăm chỉ răng miệng khiến cho răng được vệ sinh và chắc khỏe.-Với tiện lợi kép – Một đầu dùng như tăm chỉ răng miệng cùng một đầu dùng như tăm xỉa răng. Sợi chỉ răng miệng được xây đắp là sợi chỉ tơ mảnh không khiến hại và tổn hại tới lợi và răng.Tăm xỉa răng có đầu nhỏ giúp rửa sạch sâu từng kẽ răng nhưng vẫn không gây thưa răng, đau lợi.-Tạo hiệu ứng nhẹ nhàng, mềm mỏng khi sử dụng. phù hợp cho mọi độ tuổi và mọi mọi người trong gia đình.Chúc bạn 1 ngày vui vẻ"
"https://down-vn.img.susercontent.com/file/7c91a00e6a5e27262af43f6411a8e4b3@resize_w164_nl.webp","Máy cạo râu Yandou SCW 301U phong cách mạnh mẽ","4.9","198,6k","₫85.000 - ₫115.000","₫150.000 - ₫180.000","6181","➤ Bạn sẽ không cần phải tốn tiền thay dao cạo thường xuyên, không cần phải thêm chi phí mua kem bôi, tiết kiệm được rất nhiều thời gian khi sử dụng máy cạo SCW 301U➤ Máy cạo râu SCW 301U thiết kế rất mạnh mẽ, khỏe khoắn. Tuy đơn giản nhưng lại thấy vẻ rất sang trọng cùng đường nét cứng cáp của thân máy➤ Máy được sử dụng pin khô sạc lại, sau khi sạc đầy có thể sử dụng liên tục trong 45 phút. Đảm bảo bạn không bị gián đoạn công việc của mình➤ Kích thước máy rất nhỏ gọn, có thể mang theo bất cứ đâu bạn muốn➤ Máy có cấu tạo lưỡi thẳng, tiếp xúc với da cực tốt. Được bảo vệ bởi lớp thép không gỉ, an toàn tuyệt đối cho người sử dụng↦ Kích thước: 10 x 5,4 x 2,2 cm↦ Công suất máy: 3WHướng dẫn sử dụng:✳ Gạt công tắc phía trên thân máy lên trước khi sử dụng. Bạn có thể chuyển đổi chức năng của máy khi gặt công tắc phía sườn máy để biến máy thành 1 chiếc tông đơ cắt tóc.✳ Chân sạc được gắn luôn ở máy, khi cần bạn chỉ cần gạt lên là có thể dùng. Rất tiện lợi✳ Hiệu quả tối đa khi sử dụng cạo khô, không cần bôi kem cạo râu vì khi râu ở trạng thái cứng nhất sẽ dễ tiếp xúc với dao cạo- 🌻Chúng tôi Cam kết sản phẩm đúng như hình ảnh 100%.- 🌻Luôn kiểm tra hàng trước khi giao- 🌻Hoàn tiền 100% nếu khách phát hiện hàng giả, hàng lỗi hoặc giao không đúng- ❎Các mặt hàng bị lỗi hay không ưng ý,khách vui lòng liên hệ với shop trước khi đánh giá shop nhé.shop sẽ hỗ trợ đổi hoặc trả hàng cho khách ạ!❎#maycaorauchinhhang #maycaorau #muamaycaorauodau #muamaycaorauchinhhang #maycaoraugiare #maycaoraucototkhong #muamaycaorauhanoi #maycaoraudanag"
