"Image","Name","Rate Star","Sold","Selling Price","Original Price","Available Product","Description"
"https://down-vn.img.susercontent.com/file/vn-11110107-6khwc-m4ejvkwcuubr8c_cover@resize_w164_nl.webp","Dép đi trong nhà, dép văn phòng, dép quai ngang nam nữ siêu nhẹ êm chân - Z.StoreVN","4.8","29k","₫15.000 - ₫24.456","₫15.000 - ₫38.000","103168","Chào mừng bạn ghé thăm gian hàng z.storevnTên sản phẩm: Dép đi trong nhà, dép văn phòng, dép quai ngang nam nữ siêu nhẹ êm chânKiểu gót: gót bằngPhong cách: Hàn QuốcChất liệu đế: EVAChức năng: chống trượt, nhẹ, chống mài mòn, khô nhanh, chống hôi chânHọa tiết: trơn🎗️Bảng SizeĐo theo chiều dài bàn chân- Size 36-37: 22cm- Size 38-39: 23cm- Size 40-41: 24cm- Size 42-43: 25cmLoại dép này khách hàng nên tăng 1 size sẽ thoải mái hơn⭕Lưu ý:🆘 Quý khách vui lòng QUAY LẠI VIDEOmở gói hàng để tiện cho khiếu nại khi đơn hàng gặp vấn đề thiếu sót hoặc sai màu sắc⛔Sản phẩm có thể có sai số nhất định cho phép 0,5cm trong quá trình sản xuất, bảng size chỉ là đề xuất cho khách hàng tham khảo.⛔Sản phẩm ở ngoài có thể sẽ nhạt màu hơn so với ảnh chụp do ảnh đã tăng sáng⛔Nếu Quý khách có vấn đề sau khi nhận hàng, vui lòng liên hệ ngay với shop để được giải quyết tốt nhất. Xin cảm ơn!❗QUY ĐỊNH ĐỔI TRẢ1. Điều kiện áp dụng- Đổi trả trong vòng 15 ngày kể từ khi nhận sản phẩm- Hàng hóa vẫn còn mới, chưa qua sử dụng- Hàng hóa bị lỗi hoặc hư hỏng do vận chuyển hoặc do nhà sản xuất.2. Trường hợp được chấp nhận- Hàng không đúng size, kiểu dáng như khách hàng đặt hàng- Không đủ số lượng, không đủ bộ như trong đơn hàng.Cảm ơn và chúc bạn mua sắm vui vẻ#dep #depditrongnha# depxop #depmangtrongnha #deptrongnh #depnam #depnu #depditrongnha #depmuadong #depvanphong #depdep #depchonghoichan #z.storevn #depdoi."
"https://down-vn.img.susercontent.com/file/vn-11110105-7r98o-lrsymb47o19h3c@resize_w164_nl.webp","[COMBO] 5 Chai xịt Khử Mùi Giày Nano Bạc Diệt Khuẩn Ngăn Ngừa Hôi Chân Lưu Hương 24h Hương Chanh - Đào","4.8","16,6k","₫17.900","₫29.000","479359","Combo 5 Lọ/Bình/chai Xịt khử mùi giày công nghệ Nano Bạc mùi dịu nhẹ 260ml đánh bay mùi hôi dép chân tủ giày hiệu quảThông tin sản phẩm:- Thành phần : Nano bạc (Ag+) , Hương liệu, cồn thơm, chất khử trùng, chất khử mùi…- Dung tích : 260ml - 120gam- Hạn sử dụng 3 năm từ ngày sản xuấtĐặc điểm nổi bât :- Dù đã vệ sinh giày sạch sẽ bạn cũng không thể tránh khỏi việc giày có mùi khó chịu như mùi da, mùi ẩm mốc, mùi vớ … đặc biệt với thời tiết mưa gió thất thường, giày sẽ mang mùi hôi khó chịu. Đồng thời, sau một thời gian dài sử dụng, mùi hôi từ những đôi giày cũng tỏa ra làm chúng ta không tự tin khi diện chúng đi ra ngoài. Vậy làm sao để có thể khử mùi hôi giày và giữ chúng luôn được thơm tho? Với công nghệ nano bạc cùng hạt lưu hương độc đáo lọ Xịt giày khử mùi nhãn hiệu GNCE với mùi thơm dịu nhẹ sẽ giúp bạn xóa tan đi nỗi lo hôi giày.- Dễ dàng xịt giày bằng cách xịt ngược- Hiệu quả tức thì- An toàn , không gây tổn thương hay kích ứng với da- Công nghệ nano bạc ức chế vi khuẩn gây mùi hiệu quả , nhất là dạng xịt trực tiếp vào bề mặt chứa vi khuẩn gây mùiHướng dẫn sử dụng:- Xịt vào giày, dép, mũ xe máy trước khi sử dụng- Bảo quản nơi khô mát, tránh ánh nắng- Công Dụng: Bảo vệ đôi chân thoáng mát, sảng khoái, ngăn ngừa vi khuẩn gây mùiLọ/Bình/Chai Xịt khử mùi giày công nghệ Nano Bạc mùi dịu nhẹ 260ml đánh bay mùi hôi dép chân tủ giày hiệu quảNếu có thắc mắc hãy liên hệ ngay với shop để được tư vấnCảm ơn quý khách đã ghé xem sản phẩm của shop, chúc quý khách một ngày tốt lành!#khuhoichan #khuhoigiay #giadunghoangdung21 #khumuigiay #khumuihoigiay #khumuitugiay #xitkhuhoichan #xitkhuhoigiay #xitkhumuihoichan #xitkhumuihoi #chaibinhxit"
"https://down-vn.img.susercontent.com/file/https%3A%2F%2Fdown-aka-sg.img.susercontent.com%2Fsg-11110166-7rd60-ltyyr478ox7aee@resize_w164_nl.webp","1 Keo Dán Giày Mạnh Đa Năng - Keo Chống Thấm Nước Để Sửa Giày Nhanh","4.7","194,1k","₫22.680","₫38.880","838","🌟 Chào mừng bạn đến với Lựa chọn Giá trị! 🌟Cảm ơn bạn đã xem xét Keo dán giày đa năng của chúng tôi! Chất kết dính chất lượng cao này hoàn hảo cho mọi nhu cầu sửa chữa giày dép của bạn. Được làm từ vật liệu bền, không thấm nước, đảm bảo độ liên kết lâu dài, lý tưởng cho cả giày thường và giày thể thao. Mỗi gói chứa một ống, cung cấp cho bạn đủ keo để sửa chữa nhiều lần.🛠️ Các tình huống sử dụngCho dù bạn đang sửa một đôi giày thể thao yêu thích hay khôi phục một đôi ủng yêu quý, keo dán giày của chúng tôi đủ linh hoạt cho bất kỳ dịp nào. Nó phù hợp cho tất cả mọi người - từ cha mẹ bận rộn đến vận động viên - khiến nó trở thành vật dụng cần có trong mọi hộ gia đình.🛒 Mẹo mua hàngXin lưu ý rằng sự khác biệt về màu sắc có thể xảy ra do cài đặt ánh sáng và màn hình; chúng tôi khuyên bạn nên tham khảo sản phẩm thực tế để biết độ chính xác. Nếu bạn có bất kỳ câu hỏi nào hoặc gặp bất kỳ vấn đề nào, đừng ngần ngại liên hệ với nhóm dịch vụ khách hàng của chúng tôi. Chúng tôi ở đây để đảm bảo bạn có một trải nghiệm mua sắm tuyệt vời!🎉 Theo dõi chúng tôiLuôn cập nhật các phiếu giảm giá và giảm giá trong tương lai bằng cách theo dõi cửa hàng của chúng tôi! Chúng tôi đánh giá cao sự ủng hộ của bạn và mong được phục vụ bạn một lần nữa.♥ Thỏa sức mua sắm của bạn! ♥"
"https://down-vn.img.susercontent.com/file/vn-11110105-7r98o-lwwrt8pbg9c122@resize_w164_nl.webp","Chai xịt vệ sinh giày Sneaker Geto, Xịt vệ sinh giày xịt làm sạch giày dạng bọt xịt khử mùi hôi giày","4.8","26,9k","₫39.000 - ₫99.000","₫60.000 - ₫190.000","122161","Chai xịt vệ sinh giày Sneaker Geto, Xịt vệ sinh giày xịt làm sạch giày dạng bọt xịt khử mùi hôi giàyVới công nghệ từ ion Ag+ tiêu diệt vi khuẩn lên đến 99% và hoạt chất giặt giày chuyên dụng, xịt bọt giặt khô giày GETO giúp loại bỏ vết bẩn và mùi hôi khó chịu trên bề mặt giày. Hãy cùng GETO khám phá những thông tin chi tiết của Xịt giặt khô giày tạo bọt GETO nhé.- - - - - - - - - -✔✔ THÔNG TIN SẢN PHẨM CHAI VỆ SINH GIÀY GETO- Thương hiệu: GETO- Dung tích: 300ml/chai- Màu sắc: Không màu- Xuất xứ: Việt Nam- Sản xuất: Trung quốc- Thời hạn sử dụng: 3 năm- Phạm vi sử dụng: Sử dụng tốt nhất cho các sản phẩm giày da trơn, bề mặt nhẵn, hạn chế dùng trên giày da vải- - - - - - - - - -✔✔ CÔNG DỤNG SẢN PHẨM CHAI VỆ SINH GIÀY GETO- Loại bỏ vết bẩn và mùi hôi: Chai xịt tạo bọt vệ sinh GETO giúp loại bỏ mọi vết bẩn và mùi hôi khó chịu trên bề mặt giày sneaker, mang đến sự sạch sẽ và thoải mái khi sử dụng.- Dưỡng da giày: Lớp bọt mịn giúp làm giảm ma sát giữa da giày và bàn chải đánh giày, giúp dưỡng da giày và đảm bảo vệ sinh tuyệt đối.- Sử dụng đa năng: Không chỉ dành riêng cho sneaker, sản phẩm còn phù hợp để vệ sinh những sản phẩm khác như túi xách, mũ bảo hiểm, ….- Mùi hương dịu nhẹ: Phiên bản nâng cấp của xịt tạo bọt vệ sinh- - - - - - - - - -✔✔ HƯỚNG DẪN SỬ DỤNG CHAI VỆ SINH GIÀY GETO- BƯỚC 1: Xịt bọt đều lên phần cần làm sạch- BƯỚC 2: Xịt bọt xong rồi, bạn phải làm ướt bàn chải để vệ sinh- BƯỚC 3: Sử dụng bàn chải để chà và lau chùi các bộ phận bạn muốn vệ sinh, hãy nhớ là thật chậm thật chậm nhé, vì có lớp bọt phủ lên nên không cần chà mạnh.- BƯỚC 4: Cuối cùng thì dùng khăn mềm để loại bỏ bọt, lâu khô các bụi bẩn.- - - - - - - - - -✔✔ LƯU Ý- BƯỚC 1: Xịt bọt đều lên phần cần làm sạch- BƯỚC 2: Xịt bọt xong rồi, bạn phải làm ướt bàn chải để vệ sinh- BƯỚC 3: Sử dụng bàn chải để chà và lau chùi các bộ phận bạn muốn vệ sinh, hãy nhớ là thật chậm thật chậm nhé, vì có lớp bọt phủ lên nên không cần chà mạnh.- BƯỚC 4: Cuối cùng thì dùng khăn mềm để loại bỏ bọt, lâu khô các bụi bẩn.#xitvesinhgiay #chaivesinhgiay #xittaobot #nuoclaugiay #lamsachgiay #giatgiay #giaydep #giay #sneaker #giaythethao #vesinhgiay #cleangiay #giamgia #sale #sanphamchogiay #ximo #lamsachgiay #vesinhgiay"
"https://down-vn.img.susercontent.com/file/sg-11110106-7rdxu-lykr8idh8ktwe0@resize_w164_nl.webp","Miếng Dán Chống Trượt Đế Cuộn 1M / Cuộn - Thảm Bảo Vệ Đế - Băng Im Lặng Đế Tự Dính - Chống Trơn Trượt, Chống Mài Mòn - Phụ Kiện Miếng Dán Sửa Giày - Miếng Dán Đáy Chăm Sóc Gót Cao","4.4","2,5k","₫8.347 - ₫35.931","₫16.252 - ₫61.990","307527","“” Chào mừng đến với cửa hàng của chúng tôi ”Chúng tôi hứa:1: Hoàn tiền đầy đủ nếu bạn không nhận được đơn đặt hàng của mình2: Hoàn tiền đầy đủ hoặc một phần, nếu mặt hàng không như mô tảMô tả sản phẩm:“Một phong cách ”Kết cấu vật liệu: EVAMàu đenKích thước: 100 * 10cm / 8x100cm / 6x100cm﻿Danh sách đóng gói1 * Miếng dán chống trượt đế giày / 5 * Miếng dán chống trượt đế giày“Kiểu B ”Chất liệu: Cao suMàu: Đen, TrắngKích thước: 100 * 5cmKích thước gói 5,4 * 5,4 * 5 cmSố lượng: 1“Phong cách C ”Chất liệu: EVAMàu đenKích thước: 40mm * 2mKích thước đóng gói: khoảng 12,5 * 12,8 * 4cmSố lượng: Bán từng cái mộtDanh sách đóng gói1 * đế chống mài mòn và dán im lặng“Phong cách D ”Kiểu: miếng dán bảo vệ im lặng chống trượt đếChất liệu: siliconeMàu: đen, trong suốt, mơ, màu daKích thước: 90 * 65mmSố lượng: 1 / 2 cặpMô tảMiếng dán chống trượt và chống mài mòn cho đế, giải quyết sự bối rối và rắc rối của đế trơnThiết kế bề mặt kết cấu sóng thô đặc biệt sẽ có tác dụng chống trơn trượt tốt, chắc chắn và chống mài mònGiúp bảo vệ bạn khi đi bộ và cũng bảo vệ đếBảo vệ đế giày yêu quý của bạn không bị hao mònGói bao gồm: 1 / 2 * cặp miếng dán đế chống trượt“Phong cách E ”Chất liệu: Cao suKích thước: 9 * 6,5 * 0,15cmMàu đenHình dạng: Hình elipSố lượng: 5 đôiGói bao gồm: 5 đôi * miếng dán chống trượt đế“Phong cách F ”Chất liệu: cao su PVCKích thước: 6,5 * 6,5cmMàu đenHình dạng: Hình vuôngSố lượng: 5 đôiGói bao gồm: 5 đôi * miếng dán chống trượt đế“Phản hồi ”:Dịch vụ cửa hàng của chúng tôi có sẵn 24 giờChúng tôi có đủ hàng cho những khách hàng yêu quý của chúng tôiLưu ý:Do điều kiện ánh sáng và màn hình khác nhau, màu sắc có thể khác với màu sắc. Vui lòng tham khảo đối tượng thực tế.~ Cảm ơn bạn đã đến và chúc bạn một cuộc sống hạnh phúc ~"
"https://down-vn.img.susercontent.com/file/vn-11110105-7ras8-m1u02pmfc6f532@resize_w164_nl.webp","Dép đi trong nhà dép lỗ mặt cười nữ nam đi văn phòng nhà tắm chống trơn trượt","4.9","107,9k","₫15.950 - ₫22.500","₫29.000 - ₫32.000","5287","Dép đi trong nhà dép lỗ mặt cười nữ nam đi văn phòng nhà tắm chống trơn trượtLƯU Ý: LƯU Ý: CÁC BẠN NỮ NÊN CHỌN TĂNG TỪ 2-3 SIZE SO VỚI SIZE GIÀY THƯỜNG ĐI, CÁC BẠN NAM CHỌN TĂNG 1-2 SIZE SO VỚI SIZE GIÀY THƯỜNG ĐI ĐỂ TĂNG ĐỘ THOẢI MÁI CHO BÀN CHÂN KHI SỬ DỤNG, NÂNG CAO TÍNH CHẤT THƯ GIÃN CHO BÀN CHÂN SAU 1 NGÀY HOẠT ĐỘNG MỆT MỎI VÍ DỤSize giày thường đi size 34 nên chọn dép đi trong nhà size 36Size giày thường đi size 35 nên chọn dép đi trong nhà size 37Size giày thường đi size 36 nên chọn dép đi trong nhà size 38Size giày thường đi size 37 nên chọn dép đi trong nhà size 39Size giày thường đi size 38,39 nên chọn dép đi trong nhà size 40Size giày thường đi size 40 nên chọn dép đi trong nhà size 41Size giày thường đi size 41 nên chọn dép đi trong nhà size 42Size giày thường đi size 42 nên chọn dép đi trong nhà size 43Chất liệu: Cao su mềm, nhẹThương hiệu: Việt San PlasticChiều dày đế 2,5cmXuất xứ: Việt NamViệt San nâng niu bước chân việt:- Phong cách thời trang.- Chất lượng tiêu chuẩn.- An toàn sử dụng- Hàng Việt Nam chất lượng caoDép thủng Việt San chất liệu cao su mềm đế dày, tạo cảm giác êm chân thư giãn cho người sử dụng, mặt dép có lỗ thủng phù hợp sử dung để đi trong nhà, phòng tắm, sân phơi.... Tạo cảm giác chân êm ai cho người sử dụng.Kiểu dép có 4 màu chính: Xanh lá, xanh dương, đen và nâuDép lỗ mặt cười Việt San có các size dép từ:Dép lỗ mặt cười đi nhà tắm size 36: chiều dài dép 23cmDép lỗ mặt cười đi nhà tắm size 37: chiều dài dép 23,5cmDép lỗ mặt cười đi nhà tắm size 38: chiều dài dép 23,7cmDép lỗ mặt cười đi nhà tắm size 39: chiều dài dép 24cmDép lỗ mặt cười đi nhà tắm size 40: chiều dài dép 25cmDép lỗ mặt cười đi nhà tắm size 41: chiều dài dép 25,5cmDép lỗ mặt cười đi nhà tắm size 42: chiều dài dép 26cmDép lỗ mặt cười đi nhà tắm size 43: chiều dài dép 26,5cmCăn cứ theo size và chiều dài dép, bạn lựa chọn đôi dép phù hợp nhất với kích cỡ bàn chân cá nhân sử dụng,LƯU Ý: LƯU Ý: NÊN CHỌN SIZE TO HƠN 1-2 CỠ SO VỚI SIZE GIÀY THƯỜNG ĐI ĐỂ TĂNG ĐỘ THOẢI MÁI CHO BÀN CHÂN KHI SỬ DỤNG, NÂNG CAO TÍNH CHẤT THƯ GIÃN CHO BÀN CHÂN SAU 1 NGÀY HOẠT ĐỘNG MỆT MỎI#depditrongnha #depmatcuoi #dep #deplo #depdinhatam #depthungCÁ ĐỦ CỎ - CÓ ĐỦ CẢ"
"https://down-vn.img.susercontent.com/file/vn-11110107-7r98o-lzzjv21i20625e@resize_w164_nl.webp","Lót Giày Cao Su Non Cao Cấp đàn hồi chống sốc cao, Đế Lót Giày Thể Thao Nam Nữ Siêu Mềm, Thoáng Khí, Khử Mùi Hiệu Quả","4.9","8,6k","₫22.900 - ₫33.800","₫35.000 - ₫40.000","3665","Thông tin sản phẩm: Lót giày cao su non cao cấp, lót giày thể thao nam nữ siêu êm -thoáng khí -khử mùi hôi, đế dày chống sốc đứng láu không mỏiTrọng lượng: 60gamMàu sắc: Xanh dươngSize số: 35-36 ; 37-38 ; 39-40 ; 41-42 ; 43-44Chức năng: Lót khử mùi, giảm xóc, thoáng khí , thấm hút mồ hôiGiày áp dụng: các loại giày thể thao: bóng đá, bóng rổ, giày da, giày cao cổ, giày công sở, giày vải.Giới tính áp dụng: Nam/Nữ /UnisexMùa thích hợp: 4 mùaTuỳ chỉnh: Có thể cắt phù hợp với size giày#lotgiay #lot_giay_nam_nu #lot_giay_cao_su_non#đế_lót #đế_lót_giày #đế_lót_giày #cặp_lót_giày#lót_giày_nam#lot_giay_nu #lót_giày_thể_thao #lót_giày_điều_hoà #lót_giày_êm #lót_độn#miếng_lót_giày #lót_giày_thể_thao #lót_giày_da#tổng_đại_lý_sủi #sport_drink"
"https://down-vn.img.susercontent.com/file/vn-11134201-7ras8-m64x36010cvq7b@resize_w900_nl.webp","Balo nữ kèm gấu thời trang đi học đi làm đi chơi BL10","5.0","3","₫1.000","NULL","19654","Balo nữ kèm gấu thời trang đi học đi làm đi chơi BABUMAP-BL003-THÔNG TIN SẢN PHẨM :Tên sản phẩm : Balo nữ kèm gấu thời trang đi học đi làm đi chơi BABUMAP-BL003Màu sắc : NÂU-HỒNGChất liệu : Da PUShop chuyên cung cấp các mặt hàng: Túi Xách Nữ, Túi Đeo Chéo Nữ,Túi Đeo Vai, Ví Nữ, Túi Kẹp Nách Nữ,Túi Đeo Chéo MiNi, Túi Xách Nữ Công Sở, Túi Du Lịch… Sang trọng, Cao cấp. Túi Xách của shop luôn đa dạng từ mẫu mã, kiểu dáng đến chất liệu: Túi Da, Túi Vải, Túi Đi Học, Túi Đi Chơi, Túi Tote…#tuixachnu #tuixach #tui #nu #tuideocheo #tuicamtay #tuithoitrang #tuichome #tuidulich #tuixachtay #tuitang #tuixachnu #tuinu #tuideocheo #tuihoatiet #tuixachdep #tuixachthoitrang #tuixach #tuixachnuthoitrang #tuixachtay #tuidutiec #tuidichoi #tuidihoc #tui #xach #tuixachcamtay #tuixachnudep #tuida #tuixachtay #tuiditiec #tuicongsonu #tuixachkepnachnu #tuixachdep"
"https://down-vn.img.susercontent.com/file/vn-11110105-6khw0-m712ra4axe7s38_cover@resize_w164_nl.webp","Balo đi học balo nữ thời trang đẹp đi chơi phong cách thời trang hàn quốc BL9","5.0","2","₫1.000","NULL","19654","MÔ TẢ SẢN PHẨM:Balo đi học balo nữ thời trang đẹp đi chơi phong cách thời trang hàn quốc Babumap- BL050- Kích thước: sz28 cm- Chất liệu: Da PU cao cấp, mềm, bóng, không nhăn, dễ lau chùi và bảo quản- Đặc điểm nổi bật:- Màu sắc:nâu, đen- Thiết kế rất dễ phối hợp cùng nhiều kiểu trang phục khác nhau giúp các bạn khách iu nữ bớt lo lắng khi set up đồ.- Thích hợp: Đi chơi, đi học, đi làm, du lịch, công sở…=================================➤BẢO QUẢN:✦ Dùng khăn ẩm lau sạch khi đi mưa, bụi bẩn bám✦ Để nơi khô ráo thoáng mát tránh bị ẩm mốc💖 QUYỀN LỢI CỦA KHÁCH HÀNG✦ Khách hàng cũ : Mua lần thứ 2 trở đi sẽ được nhận mã giảm giá của shop << ib ngay cho shop  nhé >> để nhận ưu đãi bạn nhaaa✦Chính sách bao đổi trả hàng miễn phí khi sản phẩm kém chất lượng và không giống hình, nhầm size, số lượng=================================❣️  Doris Bags  ĐẢM BẢO :➡ BẢO ĐẢM HÀNG CHẤT 100% - GIÁ RẺ ĐẸP➡ Giao hàng ngay khi nhận được đơn hàng - Giao hàng toàn quốc, nhận hàng thanh toán➡ Gửi hàng siêu tốc - Luôn kiểm tra hàng trước khi giao - Hỗ trợ đổi trả theo quy định."
"https://down-vn.img.susercontent.com/file/vn-11110105-6khw5-m64x0kvfahqv46_cover@resize_w164_nl.webp","BALO DA ĐẸP ĐEO VAI ĐI HỌC ĐI CHƠI PHONG CÁCH HÀN QUỐC BL8","5.0","4","₫1.000","NULL","19682","MÔ TẢ SẢN PHẨM: BALO DA ĐẸP ĐEO VAI ĐI HỌC ĐI CHƠI PHONG CÁCH HÀN QUỐC - BL024- Kích thước: sz cm- Chất liệu: Da PU cao cấp, mềm, bóng, không nhăn, dễ lau chùi và bảo quản- Đặc điểm nổi bật:- Màu sắc:  Đen, trắng- Thiết kế rất dễ phối hợp cùng nhiều kiểu trang phục khác nhau giúp các bạn khách iu nữ bớt lo lắng khi set up đồ.- Thích hợp: Đi chơi, đi học, đi làm, du lịch, công sở…=================================➤BẢO QUẢN:✦ Dùng khăn ẩm lau sạch khi đi mưa, bụi bẩn bám✦ Để nơi khô ráo thoáng mát tránh bị ẩm mốc💖 QUYỀN LỢI CỦA KHÁCH HÀNG✦ Khách hàng cũ : Mua lần thứ 2 trở đi sẽ được nhận mã giảm giá của shop << ib ngay cho shop  nhé >> để nhận ưu đãi bạn nhaaa✦Chính sách bao đổi trả hàng miễn phí khi sản phẩm kém chất lượng và không giống hình, nhầm size, số lượng=================================❣️  Doris Bags  ĐẢM BẢO :➡ BẢO ĐẢM HÀNG CHẤT 100% - GIÁ RẺ ĐẸP➡ Giao hàng ngay khi nhận được đơn hàng - Giao hàng toàn quốc, nhận hàng thanh toán➡ Gửi hàng siêu tốc - Luôn kiểm tra hàng trước khi giao - Hỗ trợ đổi trả theo quy định."
"https://down-vn.img.susercontent.com/file/vn-11134207-7ra0g-m713adij35wh11@resize_w900_nl.webp","Balo nữ balo mini cá tính dáng siêu xinh đi chơi bao đẹp dễ thương thiết kế thời trang BL7","4.8","146","₫1.000","NULL","19690","Balo nữ balo mini cá tính dáng siêu xinh đi chơi bao đẹp dễ thương thiết kế thời trangChất liệu da cao cấp. Ba lô là một phụ kiện thời trang không thể thiếu của các bạn trẻ dù là nam hay nữ, nó thể hiện phong cách cũng như cá tính của chủ nhân. Nếu bạn yêu thích phong cách đơn giản nhưng tinh tế thì chiếc Ba lô  là một lựa chọn hoàn hảo cho bạn. Chiếc Ba lô sở hữu thiết kế thời trang với phần nắp túi cách điệu, những đường may tinh tế, trẻ trung năng động sẽ vô cùng hữu dụng cho bạn trong việc chứa các vật dụng cá nhân. Bên cạnh đó, Ba lô còn thể hiện gu thời trang và cá tính của bạn.ĐẶC ĐIỂM NỔI BẬT1. Chất liệuĐược làm từ chất liệu da PU chất lượng cao, balo thời trang mềm mại và bền chắc. Do đó, bạn sẽ dễ dàng bảo quản và vệ sinh. Hiện nay, các loại balo làm từ chất liệu như thế này đang tạo thành những cơn lốc thịnh hành nhất đối với giới trẻ.2. Thiết kế trẻ trungBalo thời trang được thiết kế trẻ trung, quai đeo bền chắc cùng kiểu dáng đẹp mắt kết hợp tinh tế giữa nét cổ điển và hiện đại, tạo nên sự hài hòa tuyệt đối làm bạn khó có thể từ chối được.3. Đường may tỉ mỉ chắc chắnChiếc balo thời trang với đường may tỉ mỉ và tinh tế đảm bảo độ bền chắc trong suốt thời gian bạn sử dụng, balo sẽ mang đến cho bạn vẻ đẹp thật cá tính và lịch lãm.4. Dễ phối trang phụcBalo thời trang với gam màu truyền thống, không chỉ giúp bạn thể hiện phong cách thời trang cá tính mà còn giúp dễ dàng khi phối chiếc cặp cùng nhiều trang phục như: quần jean, áo thun hay phụ kiện khác để trở nên thật sang trọng và đẳng cấp.6, Chất Liệu: Da PU7, Bảo hành: 6 THÁNG8,Xuất sứ: Việt Nam9, SIZE : 20x19x9#BALO, #BALONU , #BALOTHOITRANG , #BALORE, #balomini , #bachhoaonline68 , #baloda"
